title,link,summary,category
See Yo La Tengo Cover the Ramones With Marky Ramone at Hanukkah Show,https://www.rollingstone.com/music/music-news/yo-la-tengo-the-ramones-marky-ramone-hanukkah-show-1234652104/,SpongeBob SquarePants voice actor Tom Kenny provides lead vocals on Ramones-filled encore,Blitzkrieg Bops
Journey's Neal Schon Files Cease-and-Desist Against Jonathan Cain for Playing Band's Music at Trump Events,https://www.rollingstone.com/music/music-news/journey-neal-schon-cease-and-desist-jonathan-cain-trump-1234651811/,"Cain and backup singers Marjorie Taylor Greene, Kimberly Guilfoyle, and Kari Lake performed ""Don't Stop Believin'"" at Mar-A-Lago in November",Separate Ways
Rex Orange County: Sexual Assault Charges Dismissed Following Investigation,https://www.rollingstone.com/music/music-news/rex-orange-county-sexual-assault-charges-dropped-1234651788/,"""I have always denied these allegations and am grateful that the independent evidence has cleared me of any wrongdoing,"" the musician shared in a statement",Charges Dropped
O2 Academy Brixton to Face Licensing Review After Asake Crush,https://www.rollingstone.com/music/music-news/o2-academy-brixton-licensing-review-asake-crush-1234651800/,"Two people lost their lives last week when a crowd forced their way into the venue, causing mass overcrowding",Crowd Crush
Dave Grohl and Daughter Violet Cover Janis Ian’s ‘At Seventeen’,https://www.rollingstone.com/music/music-news/dave-grohl-daughter-violet-cover-janis-ian-at-seventeen-1234651756/,Violet Grohl joined her father and keyboardist Greg Kurstin for the fourth night ofHanukkah Sessions,A Timeless Cover
Tory Lanez Declines to Testify at Megan Thee Stallion Shooting Trial,https://www.rollingstone.com/music/music-news/tory-lanez-megan-thee-stallion-declines-testify-closing-arguments-1234651517/,"""After more than two years of this torture, it is finally time for you, members of the jury, to find the defendant guilty,"" a prosecutor argued in his closing",Courts & Crime
Kid Cudi Reveals Collaborative Album With Travis Scott Isn't Happening: ‘The Moment Has Passed’,https://www.rollingstone.com/music/music-news/kid-cudi-collaborative-album-travis-scott-not-happening-the-scotts-1234651474/,"However, rapper doesn't rule out future recordings by ""The Scotts""",Scotts Fired
‘Power Run Amok’: Madison Square Garden Uses Face-Scanning Tech to Remove Perceived Adversaries,https://www.rollingstone.com/music/music-news/madison-square-garden-face-scan-1234650989/,"Over the past month, multiple attorneys whose firms have litigation against the venue have said MSG used facial-recognition tech to find them and kick them out of shows by Brandi Carlile and the Rockettes",Face-off
Unfoonk Forbidden From Contacting Brother Young Thug After Taking Plea Deal in YSL Case,https://www.rollingstone.com/music/music-news/young-thug-brother-unfoonk-ysl-gang-case-plea-deal-restricted-contact-1234651403/,"Rapper is the latest to accept a plea deal in connection to the 56-count RICO indictment, joining Gunna, Lil Duke, and Slimelife Shawty",YSL Trial
How to Watch Alicia Keys' Holiday Masquerade Ball Concert on Apple Music Live,https://www.rollingstone.com/music/music-news/how-to-watch-alicia-keys-apple-music-live-concert-1234650334/,"The Grammy winner's United Palace show in New York airs on Apple Music and TikTok on Wednesday, Dec. 21, and includes special guests from Jon Batiste to JVKE",'Thee Holiday Party of the Season'
Mac DeMarco Continues Yuletide Tradition With 'It’s Beginning to Look a Lot Like Christmas' Cover,https://www.rollingstone.com/music/music-news/mac-demarco-its-beginning-to-look-a-lot-like-christmas-cover-1234651388/,"Since 2015, indie rocker has put his spin on an Xmas classic",Mac and Cookies
H&M Pulls Justin Bieber Merch After Pop Star Called It ‘Trash’,https://www.rollingstone.com/music/music-news/hm-pulls-justin-bieber-line-1234651375/,"While the fast fashion giant yanked the items, it denied the singer's claims that he did not approve the designs",Fashion Feud
"Specials Singer Terry Hall Died After Pancreatic Cancer Battle, Bassist Says",https://www.rollingstone.com/music/music-news/the-specials-terry-hall-died-pancreatic-cancer-1234651307/,"Horace Panter explained how quickly Hall's health deteriorated this fall, just as the ska band was about to record a new album",RIP Terry Hall
"DaBaby Found Not Liable of Breach of Contract, Battery in $6 Million Lawsuit",https://www.rollingstone.com/music/music-news/dababy-nightclub-lawsuit-not-liable-breach-of-contract-assault-battery-1234651245/,The rapper still faces multiple unrelated lawsuits ranging from felony battery assault to copyright infringement,Not in the Clear Yet
Weezer Ring in the Solstice With Final ‘SZNZ’ EP ‘Winter’,https://www.rollingstone.com/music/music-news/weezer-release-final-sznz-ep-winter-1234651213/,Seven-track project includes some of the Elliot Smith-style sounds Rivers Cuomo teased — but also a lot of classic guitar crunch,Frosty Riffs
Rapper Who Posed at Capitol Riot for Album Cover Sentenced to Prison,https://www.rollingstone.com/music/music-news/rapper-posed-capitol-riot-album-cover-sentenced-five-months-1234651058/,"Antionne Brodnax, known as Bugzie the Don, was spotted in photos inside the Capitol building on Jan. 6",Rioting Rapper
Dave Grohl and Inara George Cover 10cc’s ‘The Things We Do For Love’,https://www.rollingstone.com/music/music-news/inara-george-dave-grohl-cover-10ccs-the-things-we-do-for-love-1234651113/,"Night three of theHanukkah Sessionsenlisted ""the bird"" to sing 10cc’s hit song",The Bird Lands
Damon Albarn Remembers Late Terry Hall With Heartfelt Piano Cover,https://www.rollingstone.com/music/music-news/damon-albarn-remembers-terry-hall-specials-1234651046/,"The Blur frontman played the Specials' ""Friday Night, Saturday Morning"" in a sweet tribute",A Special Place
John Mayer Likes Playing Guitar Naked After Sex ‘With a Little Gut Hanging Over’,https://www.rollingstone.com/music/music-news/john-mayer-loves-playing-guitar-naked-after-sex-1234650853/,TheSob Rocksinger says he wasn't made to be an A-list celebrity,Serenades After Sex
Shania Twain Feels a ‘Renewed Confidence’ Despite Health Setbacks,https://www.rollingstone.com/music/music-news/shania-twain-interview-renewed-confidence-health-setbacks-1234650978/,"""I'm happy in my own skin. I’m celebrating that feeling, less apologetic for who I am and what I’ve become,"" she previously toldRolling Stone",2023 Is the Year
"Tory Lanez Trial: Witness Says One Muzzle Flash Near Female, Then Male 'Was Firing Everywhere’",https://www.rollingstone.com/music/music-news/tory-lanez-trial-megan-thee-stallion-shooting-witness-testifies-1234650863/,"“It appeared to me when I was on the phone that they were trying to kill her,” 911 caller Sean Kelly told jurors at Tory Lanez's trial over Megan Thee Stallion shooting",Courts & Crime
Dave Grohl Dusts Off Classic Deep Cut ‘Marigold’ for Virtual Charity Concert,https://www.rollingstone.com/music/music-news/dave-grohl-rare-performance-marigold-1234650890/,"Foo Fighters frontman performed an acoustic rendition of the early-Nineties track during the ""Letters to Santa"" fundraiser",Rare Grohls
Paul McCartney Recalls Struggling to Grieve John Lennon's Death Before Writing ‘Here Today’: ‘It Was Just Too Deep’,https://www.rollingstone.com/music/music-news/paul-mccartney-recalls-writing-here-today-john-lennons-death-1234650829/,"""I can't be one of those people. I can't just go on TV and say what John meant to me. It was just too deep. It's just too much,"" he remembered in a recent interview",If You Were Here Today
500 Musicians Demand Change After Juilliard Misconduct Allegations,https://www.rollingstone.com/music/music-news/juilliard-sexual-misconduct-allegations-open-letter-1234650182/,"Composers, educators, and leaders in the classical music community are calling on the institution to address sexual harassment reports",'Decades-Long Abuse'
Daniel Seavey Says a Stalker ‘Tried to Kiss’ Him After Breaking Into His House Again,https://www.rollingstone.com/music/music-news/daniel-seavey-stalker-tried-to-kiss-him-house-break-in-1234650631/,"""When fantasy becomes obsession, this is unhealthy for all involved,"" the former Why Don't We member's manager tellsRolling Stone",Another Break-in
Dolly Parton Can’t Wait 22 Years to Dig Up the Time Capsule Song She Buried Underneath Dollywood,https://www.rollingstone.com/music/music-news/dolly-parton-time-capsule-secret-song-1234650611/,"The country icon told Kelly Clarkson it isn't meant to be opened until she is 99 years old, but she's getting a little impatient",Get Your Shovel
"Watch Reneé Rapp Talk ‘Mean Girls,’ TikTok, and Following Her Heart on The Green Room",https://www.rollingstone.com/music/music-news/watch-renee-rapp-talk-mean-girls-tiktok-on-the-green-room-1234650565/,"Meet the Gen-Z “it girl” who is not just playing by her own rules, but playing a different game in a league of her own.",The Green Room
"‘Nepo Babies Have Feelings': Lily Allen Says the Real Villains Are in Politics, Not Hollywood",https://www.rollingstone.com/music/music-news/lily-allen-nepo-baby-villains-politics-versus-hollywood-1234650522/,"“And before you come at me for being a nepo baby myself, I will be the first to tell you that I literally deserve nothing,"" the singer wrote on Twitter",Bigger Fish to Fry
"Phoebe Bridgers Leads All-Star Cover of Nico's ‘These Days’ With Matty Healy, Trey Anastasio, Jack Antonoff",https://www.rollingstone.com/music/music-news/phoebe-bridgers-matty-healy-jack-antonoff-cover-nico-these-days-1234650528/,Performance at the eighth annual Ally Coalition benefit also featured Lucy Dacus and Weyes Blood's Natalie Mering,Cover for a Cause
"Get Your Light Sticks Ready, ARMY: ‘BTS Yet to Come in Cinemas’ Concert Film Heading to Theaters",https://www.rollingstone.com/music/music-news/bts-yet-to-come-in-cinemas-concert-film-theaters-1234650454/,BTS Yet to Come in Cinemaswill use immersive technology to mirror the atmosphere and physical environment of the concert,BTS Yet to Come
It's No Longer All Happening: ‘Almost Famous’ Musical to End Broadway Run After a Few Months,https://www.rollingstone.com/music/music-news/almost-famous-musical-close-broadway-1234650477/,Show will close in early January after premiering in November,Off Broadway
Primal Scream Keyboardist Martin Duffy Dead at 55,https://www.rollingstone.com/music/music-news/primal-scream-keyboardist-martin-duffy-dead-obituary-1234650455/,"'A tragic loss of a beautiful soul,' said The Charlatans' Tim Burgess of Duffy",obituary
Pusha T No Longer Tied to Kanye West's G.O.O.D. Music as Label President,https://www.rollingstone.com/music/music-news/pusha-t-kanye-west-record-label-good-music-no-longer-president-1234650443/,"""He’s not speaking to me now. If you ain’t with it, you ain’t down. And I ain’t with it. I’m not budging on that. I’m not with it,"" Pusha T said in a recent interview",Done Deal
Dave Grohl and Pink Blast Through ‘Get the Party Started' for ’Hanukkah Sessions',https://www.rollingstone.com/music/music-news/dave-grohl-pink-get-the-party-started-hanukkah-sessions-1234650378/,Night two of this year'sHanukkah Sessionsfeatured Pink blast through her 2001 hit song,Live at Largo
Bid to Hit Tory Lanez With Witness Tampering Charges Denied by Judge,https://www.rollingstone.com/music/music-news/tory-lanez-witness-tampering-bribe-charges-denied-megan-thee-stallion-trial-1234650373/,"Judge said prosecutors waited too long to file charges against Lanez for alleged attempted $1 million ""bribe"" to Megan Thee Stallion and Kelsey Harris",Courts & Crime
"Terry Hall, Lead Singer of the Specials, Dead at 63",https://www.rollingstone.com/music/music-news/terry-hall-the-specials-dead-obit-1234650232/,"""His music and his performances encapsulated the very essence of life,"" the band said in a statement",Obituary
Nipsey Hussle Killer's Bid to Reduce Murder Conviction Rejected by Judge,https://www.rollingstone.com/music/music-news/nipsey-hussle-killer-eric-holder-jr-reduce-murder-conviction-bid-rejected-1234650195/,"Eric Holder Jr. had asked for his conviction to be reduced to manslaughter due to verdict ""inconsistency""",Bid Rejected
The Pavement Musical and Museum Exhibit Were Part of Alex Ross Perry's New Pavement Movie,https://www.rollingstone.com/music/music-news/pavement-musical-museum-exhibit-alex-ross-perry-movie-1234649982/,"Film will play fast and loose with fact and fiction, but center around the question: What if Pavement was the most important band ever?",Gold Filmz
Best Believe Bob Dylan Has Thoughts on Contemporary Music and the Streaming Era,https://www.rollingstone.com/music/music-news/bob-dylan-streaming-contemporary-music-dunkin-donuts-1234650140/,"In a new interview, the singer-songwriter did some equally shrewd and crotchety old man sermonizing — and explained why he thanked the crew at Dunkin' Donuts in his new book",Bob's Thoughts
First Raw Meat And Now a Tattoo: The 1975’s Matt Healy Concert Antics Continue,https://www.rollingstone.com/music/music-news/the-1975-matty-healy-gets-tattoo-onstage-1234649930/,"A doctor uniform-donning tattoo artist engraved the words ""I'm a man"" on Healy's torso",Inked Up
Kids of the Nineties' Biggest Stars to Share Perspective on Era in MTV Docuseries,https://www.rollingstone.com/music/music-news/mtv-family-legacy-nineties-docuseries-1234649822/,"The children of Van Halen's Sammy Hagar, TLC's Chilli, and 'NSync's Joey Fatone will share insight through exclusive interviews",Nothin' Like the 90s
Second Victim Dies After Crowd Crush at Asake Concert in London,https://www.rollingstone.com/music/music-news/second-victim-dies-crowd-crush-asake-concert-1234649838/,"Gabrielle Hutchinson, who was working as contracted security, died in the early hours of Monday morning",Crowd Crush
"Dave Grohl, Greg Kurstin Got Judd Apatow Shvitzing With a Blood, Sweat and Tears Cover for Hanukkah",https://www.rollingstone.com/music/music-news/dave-grohl-greg-kurstin-hanukkah-sessions-judd-apatow-1234649628/,"Grohl and Kurstin's third ""Hanukkah Session"" series was recorded live this year with a slew of special guests",Chag Sameach
Lil Baby Heads to FIFA World Cup for ‘The World Is Yours to Take’ Video,https://www.rollingstone.com/music/music-news/lil-baby-tears-for-fears-the-world-is-yours-to-take-video-world-cup-1234649537/,"The Tears for Fears-sampling track’s visual was filmed in Doha, Qatar",World Cup Anthems
Billy Joel Postpones Madison Square Garden Show Due to Viral Infection and Vocal Rest,https://www.rollingstone.com/music/music-news/billy-joel-postpones-madison-square-garden-show-viral-infection-1234649519/,"""I’m so sorry to let you know so close to show day, but I was hoping to be closer to a full recovery by now. Sadly, that hasn’t happened,"" Piano Man says of final gig of 2022",BIG SNOT
See Lizzo Cover a Stevie Wonder Christmas Classic on ‘SNL’,https://www.rollingstone.com/music/music-news/lizzo-stevie-wonder-christmas-cover-snl-1234649435/,"Singer/rapper also performs ""Break Up Twice"" and appears in Please Don't Destroy sketch",About Damn Xmas Time
Megan Thee Stallion Bodyguard ‘Missing’ Amid Tory Lanez Trial After Implicating Rapper,https://www.rollingstone.com/music/music-news/megan-thee-stallion-bodyguard-tory-lanez-apologized-shooting-accident-1234649358/,"Justin Edison purportedly said Lanez apologized to him a day after Megan Thee Stallion shooting, claimed he was firing at the ground",Courts & Crime
Pink Floyd Quietly Put 18 Unreleased ‘Dark Side’-Era Concerts on Streaming Services,https://www.rollingstone.com/music/music-news/pink-floyd-unreleased-dark-side-era-concerts-streaming-services-1234649343/,"Thanks to copyright law, fans can hear the gigs - which span from January to December 1972 - as the band slowly perfect their classic 1973 LP on the road",Ticking Away
Olivia Rodrigo Shares Christmas Song ‘The Bels’ She Wrote When She Was 5 Years Old,https://www.rollingstone.com/music/music-news/olivia-rodrigo-christmas-song-the-bels-1234649338/,Singer delivers early Christmas present to fans ahead of new music in 2023,Happy Holidays
Watch Metallica Perform ‘Lux Æterna’ Live for First Time at Benefit Concert,https://www.rollingstone.com/music/music-news/metallica-lux-aeterna-live-benefit-concert-1234649312/,"Metal legends also debut covers of UFO and Thin Lizzy, bring out St. Vincent at Helping Hands gig in Los Angeles",Helping Hands
Woman Dies After Crush at Asake Concert in London,https://www.rollingstone.com/music/music-news/woman-dies-crush-asake-concert-london-1234649298/,Two other women remain in a critical condition following the tragic incident at Brixton Academy,'Devastated'
See Billie Eilish Bring Out Childish Gambino for ‘Redbone’ at Final ‘Hometown’ Gig in Los Angeles,https://www.rollingstone.com/music/music-news/billie-eilish-childish-gambino-redbone-at-final-hometown-gig-in-los-angeles-1234649278/,"Khalid also appeared onstage to perform ""Lovely"" and ""Location"" at Eilish's pre-birthday gig",Happy Birthday!
"Little Simz Rejects Strong Black Woman Myth, External Validation in ‘No Thank You’ Short Film",https://www.rollingstone.com/music/music-news/little-simz-no-thank-you-short-film-music-video-1234649036/,"The 10-minute film directed by Gabriel Moses features portions of five songs from the newly released record, including ""Broken,"" ""Sideways,"" and ""Heart on Fire""",No Thank You
Bombshell Interview with Megan Thee Stallion's Ex-Pal Played at Tory Lanez Trial: ‘He Was Shooting’,https://www.rollingstone.com/music/music-news/megan-thee-stallion-kelsey-harris-tory-lanez-trial-deer-headlights-1234648072/,"Kelsey Harris told prosecutors during Sept. 14 interview that she saw Lanez firing over car door and Megan looking back ""like a deer in headlights""",Courts & Crime
"Goose, Ween, and My Morning Jacket to Anchor 2023 Peach Music Festival",https://www.rollingstone.com/music/music-news/peach-music-fest-2023-lineup-goose-1234648907/,"Tedeschi Trucks Band will also headline, while the Allman Brothers tribute band Trouble No More will play a classic Allmans album front-to-back",Groovy Fest Vibes
Kendrick Lamar's New Therapist Is Helen Mirren in New ‘Count Me Out’ Video,https://www.rollingstone.com/music/music-news/kendrick-lamar-helen-mirren-count-me-out-music-video-1234648917/,Rapper co-directed the latestMr. Morale and the Big Steppersvisual with Dave Free,The Doctor Is In
Lewis Capaldi Shares a Poignant Ode to Moms in ‘Pointless’ Video,https://www.rollingstone.com/music/music-news/lewis-capaldi-pointless-video-1234648800/,"""I bring her coffee in the morning/She brings me inner peace,"" he sings",To Mum
H.E.R. Stuns as Belle Alongside Josh Groban in ‘Beauty and the Beast’ Anniversary Special,https://www.rollingstone.com/music/music-news/beauty-and-the-beast-anniversary-special-her-josh-groban-1234648734/,"The ABC special also featured Martin Short, Rita Moreno, and Shania Twain",Belle of the Ball
"Billie Eilish Surprises Hometown Show Audience with Phoebe Bridgers, Dave Grohl Appearances",https://www.rollingstone.com/music/music-news/billie-eilish-phoebe-bridgers-dave-grohl-surprise-concert-appearances-1234648648/,"The singer performed ""My Hero"" in tribute to Taylor Hawkins with Grohl before later running through ""Motion Sickness"" with Bridgers",Special Guests
"Dino Danelli, Founding Drummer of ‘Good Lovin' Rockers the Rascals, Dead at 78",https://www.rollingstone.com/music/music-news/dino-danelli-drummer-the-rascals-dead-1234648652/,Musician also played with Steven Van Zandt's band the Disciples of Soul,Obituary
Four People in Critical Condition After Suspected Crush at Asake Concert in London,https://www.rollingstone.com/music/music-news/asake-concert-crowd-crush-london-1234648586/,The incident is believed to have occurred after fans forced their way into the O2 Academy Brixton,Crowd Crush
PinkPantheress‘ Bills and Angst Keep Piling Up on New Song ’Take Me Home',https://www.rollingstone.com/music/music-news/pinkpantheress-new-song-take-me-home-surprise-ep-1234648517/,"Track appears on a new three-song EP — also titledTake Me Home— alongside recent singles ""Do You Miss Me?"" and ""Boy's a Liar","Bills, Bills, Bills"
The Weeknd Seeks Strength on Booming ‘Avatar 2’ Theme Song ‘Nothing Is Lost’,https://www.rollingstone.com/music/music-news/the-weeknd-avatar-the-way-of-water-new-music-watch-1234641243/,"Track arrives ahead of the release of James Cameron's long-awaited sequel,Avatar:The Way of Water",Weeknd Teaser
FLO Are Leaving Their Emotional Baggage in 2022 in ‘Losing You’ Video,https://www.rollingstone.com/music/music-news/flo-losing-you-music-video-1234648115/,"""It reminds you of how content you are by yourself and finding that cheerful spirit during a tough time,” the R&B group said","New Year, New Me"
‘Spinning Gold’ Trailer Chronicles the Rise of Casablanca Records,https://www.rollingstone.com/music/music-news/spinning-gold-casablanca-records-trailer-1234647970/,See Wiz Khalifa play George Clinton and Tayla Parx as Donna Summer in fictionalized retelling of story behind Neil Bogart's Seventies hits-making label,Music Movies
Trevor Noah Will Host Grammy Awards for Third Time in 2023,https://www.rollingstone.com/music/music-news/2023-grammy-awards-host-trevor-noah-1234647956/,He joins LL Cool J as the only Grammys host to lead three or more separate years of ceremonies,Three-Timers Club
Siouxsie Sioux to Perform Live for First Time in 10 Years at Latitude Festival,https://www.rollingstone.com/music/music-news/siouxsie-sioux-latitude-festival-1234647913/,Punk musician will headline the British music festival next July,Look Who's Back
Virginia Beach to Pay $3 Million Settlement in Killing of Pharrell Williams' Cousin,https://www.rollingstone.com/music/music-news/virginia-beach-settlement-pharrell-cousin-death-1234647884/,Donovon Lynch was shot and killed by police last year,Settling the Score
Carly Rae Jepsen Takes the Stage in ‘Surrender My Heart’ Video,https://www.rollingstone.com/music/music-news/carly-rae-jepsen-surrender-my-heart-video-1234647871/,Jane Krakowski and ballerina Isabella Boylston guest star in the theatrical clip,Putting on the Ritz
"Kendrick Lamar, Billie Eilish, Rüfüs Du Sol to Headline Osheaga 2023",https://www.rollingstone.com/music/music-news/osheaga-2023-kendrick-lamar-billie-eilish-rufus-du-sol-1234647845/,The Montreal festival announced its heavy hitters for the 16th edition,Osheaga 2023
Kanye West’s Love of Hitler Allegedly Goes Back 20 Years,https://www.rollingstone.com/music/music-news/kanye-wests-love-of-hitler-and-nazis-allegedly-goes-back-20-years-1234647700/,"The rapper spoke of his admiration for Hitler during the making of ‘The College Dropout,’ and even tried to use propaganda strategies inspired by the Nazis to boost his own fame, sources tellRolling Stone",EXCLUSIVE
Megan Thee Stallion's Ex-Friend Said Tory Lanez Threatened Her With Gun in Car: Prosecutors,https://www.rollingstone.com/music/music-news/megan-thee-stallion-kelsey-harris-testifies-tory-lanez-threatened-her-gun-car-1234647352/,"During a day of head-spinning testimony, Kelsey Harris admitted she gave a detailed account to prosecutors in September but then recanted key details, saying she didn't see Tory Lanez fire gun",Courts And Crime
Gunna Released From Jail After Taking Plea in YSL Gang Case,https://www.rollingstone.com/music/music-news/gunna-plea-ysl-gang-case-release-from-jail-1234647626/,The rapper is still maintaining his innocence and stressed that he is not cooperating with prosecutors,Courts and Crime
Survivors Detail Trauma in ‘Surviving R. Kelly Part III: The Final Chapter’ Trailer,https://www.rollingstone.com/music/music-news/surviving-r-kelly-part-three-trailer-final-chapter-1234647171/,The conclusion to the series will premiere on Lifetime beginning January 2,Downfall
"Lizzo Day Drinks With Seth Meyers, Plays ‘Truth Hurts’ Game",https://www.rollingstone.com/music/music-news/lizzo-seth-meyers-late-night-day-drink-1234647087/,"Chaos, confessions and laughter ensues",Drinking Buddies
Kate Hudson Will Drop an Album in 2023: ‘I Have No Expectations’,https://www.rollingstone.com/music/music-news/kate-hudson-tonight-show-album-2023-1234647071/,"""I thought that would be one of my great regrets,"" Hudson said onThe Tonight Show",'F#%! It'
Cyndi Lauper Performs as President Biden Signs Respect for Marriage Act Into Law: ‘We Can Rest Easy’,https://www.rollingstone.com/music/music-news/cyndi-lauper-joe-biden-respect-for-marriage-act-signed-into-law-1234646919/,"""Bless Joe Biden, and all the people that worked on this, for allowing people not to worry and their children not to worry about their future,"" singer said before the signing",Respect for Marriage Act
Megan Thee Stallion Tells Jury About Emotional Toll of Alleged Tory Lanez Shooting,https://www.rollingstone.com/music/music-news/megan-thee-stallion-testifies-tory-lanez-offered-her-1-million-shooting-1234646464/,"“I wish he would have just shot and killed me (rather than) have to go through this torture,” Megan told jurors, describing where her ""depressed"" thoughts sometimes wander",Courts and Crime
"Young Thug Hit With Street Racing, Reckless Driving Charges While Awaiting YSL Gang Trial",https://www.rollingstone.com/music/music-news/young-thug-street-racing-charges-1234646930/,A grand jury indicted the rapper on four misdemeanor counts tied to a May 2021 incident,Courts and Crime
