title,link,summary,category
Rebel on the Road: Billy Idol Plots 2023 North American Tour Dates,https://www.rollingstone.com/music/music-news/billy-idol-2023-north-american-tour-dates-1234666538/,Rock and roll stalwart will play a mix of headlining shows and festival sets this spring,Idol Itinerary
Kali Uchis Will Explore the ‘Burning Expression of Desire’ on New Album,https://www.rollingstone.com/music/music-news/kali-uchis-announces-album-red-moon-venus-1234666451/,"Singer will releaseRed Moon in Venuson March 3, before heading on tour in April",Divine Feminine
"‘Doja's Inferno’: Doja Cat Goes Full Glam at Schiaparelli Show With 30,000 Swarovski Crystals",https://www.rollingstone.com/music/music-news/doja-cat-schiaparelli-fashion-show-red-swarovski-crystals-1234666397/,"Ahead of the Schiaparelli Haute Couture Spring/Summer 2023 show in Paris, the singer spent nearly five hours having ruby red Swarovski crystals applied all over her body by hand",Showstopper
"Robby Krieger, Estate of Ray Manzarek Sell their Share of Doors Rights to Primary Wave Music",https://www.rollingstone.com/music/music-news/robbie-krieger-ray-manzarek-sell-the-doors-rights-primary-wave-music-1234666411/,"Deal includes publishing, recordings, and merchandise",Break on Through (to the $$$)
"Cruel World Festival 2023: Siouxsie, Iggy Pop, Billy Idol, Love and Rockets to Perform",https://www.rollingstone.com/music/music-news/cruel-world-festival-2023-lineup-announcement-1234666315/,"The festival will be held at Pasadena, California's Brookside at the Rose Bowl on Saturday, May 20",Festival Season
Big Money Generator: Yes Sell Recorded Music Catalog to Warner Music Group,https://www.rollingstone.com/music/music-news/yes-sell-recorded-music-rights-warner-music-group-1234666304/,New deal covers prog rock outfit's first 12 studio LP — including hits likeFragileand90125— as well as live albums and compilations,Owner of a Copyright
Beck and Phoenix Share Dates for 2023 Co-Headlining ‘Summer Odyssey’ Tour,https://www.rollingstone.com/music/music-news/beck-phoenix-summer-odyssey-coheadlining-north-american-tour-1234666268/,"They will be joined by Japanese Breakfast, Jenny Lewis, Weyes Blood, and Sir Chloe on select dates with",Co-Headlining
Watch Kelly Clarkson Perform Taylor Swift's ‘Better Man (Taylor's Version)’ (Kelly's Version),https://www.rollingstone.com/music/music-news/kelly-clarkson-taylor-swift-better-man-taylors-version-1234666210/,The Kellyoke selection marks the host's first performance of a Swift song since she reimagined 'You Need to Calm Down' in 2020,Kelly's Version
Stevie Nicks Plots 2023 Headlining Tour,https://www.rollingstone.com/music/music-news/stevie-nicks-2023-headlining-tour-dates-1234665880/,Singer-songwriter's solo trek kicks off in March and includes shows scheduled through June,On the Road Again
Adam Lambert Says Early Career Homophobia Inspired Him to 'Be as Gay as I F-cking Can Be’,https://www.rollingstone.com/music/music-news/adam-lambert-early-career-homophobia-visibility-2023-creative-coalition-spotlight-initiative-gala-1234666161/,"""Visibility is so powerful,"" Lambert said while accepting an award at the 2023 Creative Coalition Spotlight Initiative Gala",Loud and Proud
"Stephen Colbert, Sheryl Crow, John Mayer Trio Set for 2023 Love Rocks NYC Charity Show",https://www.rollingstone.com/music/music-news/stephen-colbert-sheryl-crow-john-mayer-love-rocks-nyc-lineup-1234665196/,"Annual benefit will also feature St. Vincent, Mavis Staples, Stephen Marley, and Andy Cohen",For a Good Cause
Behind the Graceland Gates at Lisa Marie's Memorial: ‘We Watched Her Go Through Her Struggles’,https://www.rollingstone.com/music/music-news/lisa-marie-presley-memorial-behind-the-scenes-graceland-1234665795/,"Flowers from Oprah and Axl Rose, mourners from Minnesota to Canada, and a somber mood in Memphis as thousands gather to pay their respects to the daughter of Elvis Presley",In Memphis
"Priscilla Presley, Riley Keough Share Emotional Tributes to Lisa Marie at Graceland Memorial",https://www.rollingstone.com/music/music-news/priscilla-presley-riley-keough-lisa-marie-tributes-graceland-memorial-1234665854/,"""A broken heart was the doing of her death. Now she is home where she always belonged""",Lisa Marie Memorial
"See Axl Rose, Billy Corgan, Alanis Morissette Pay Musical Tribute to Lisa Marie Presley at Graceland Memorial",https://www.rollingstone.com/music/music-news/axl-rose-billy-corgan-alanis-morissette-musical-tribute-lisa-marie-presley-graceland-memorial-1234665788/,"Guns N' Roses frontman delivers heartfelt eulogy, solo rendition of ""November Rain"" in memory of his close friend",Lisa Marie Memorial
‘SNL’: Sam Smith Recruits Kim Petras and Sharon Stone for Dramatic Performances of ‘Unholy’ and ‘Gloria’,https://www.rollingstone.com/music/music-news/snl-sam-smith-kim-petras-perform-unholy-1234665536/,"The singles are off of the singer’s fourth studio album,Gloria, which is set to be released Jan. 27",'Body Shop'
"Beyoncé Performs in Dubai, Her First Full Concert in Four Years",https://www.rollingstone.com/music/music-news/beyonce-performs-dubai-first-concert-in-four-years-atlantis-the-royal-1234665599/,Pop star’s set did not includeRenaissancesongs,Bey Back
Gunna Drops First Post-Prison Verse on New Song ‘Brodies’,https://www.rollingstone.com/music/music-news/gunna-first-post-prison-verse-new-song-brodies-ufo361-1234665565/,Rapper collaborates with Germany's Ufo361 for first new music of 2023,Gunna Back
Meat Loaf's Daughters Share Video Tribute on Anniversary of His Death,https://www.rollingstone.com/music/music-news/meat-loaf-video-tribute-death-anniversary-1234665547/,"35-minute short film features ""career highlights and private moments from our personal archives that haven’t been shared before""",For 'Papa Meat'
Kelly Clarkson Croons ‘You Should Probably Leave’ in Chris Stapleton Cover,https://www.rollingstone.com/music/music-news/kelly-clarkson-covers-chris-stapleton-you-should-probably-leave-1234665383/,"Clarkson and Stapleton released the duet ""Glow"" in 2021",Country Kellyoke
T.I.‘s ’Virginity Tests' of Daughter Excluded From Trial Over L.O.L. Dolls,https://www.rollingstone.com/music/music-news/ti-clifford-harris-tiny-virginity-tests-cannabis-excluded-lol-dolls-mga-trial-1234664270/,"A federal judge ruled Friday that evidence from the rapper's personal life — sought to cast him in a negative light was ""not relevant""","""Not Relevant"""
Macklemore Reminisces About His Disreputable ‘Heroes’ While Watching ‘Frozen’ With His Kids,https://www.rollingstone.com/music/music-news/macklemore-dj-premier-new-song-heroes-1234665022/,"Track with DJ Premier marks the fourth offering from the Seattle rapper's next solo album,Ben",Father Knows Best
BMG Suing Toymaker for Turning Black Eyed Peas‘ ’My Humps‘ Into ’My Poops' Ad,https://www.rollingstone.com/music/music-news/bmg-lawsuit-toymaker-black-eyed-peas-my-humps-my-poops-1234664931/,"Music giant claims that the Poopsie Slime Surprise, a ""unicorn doll that excretes sparkling slime,""  somehow ""devalued"" Will.i.am's ode to junk in the trunk",Legal Shit
"Ian Hunter Jams With Late Jeff Beck, Taylor Hawkins, and Beatles, Metallica, GN'R Members on New Album",https://www.rollingstone.com/music/music-news/ian-hunter-defiance-part-1-album-1234664894/,'Defiance Part 1' to arrive in the spring,Guest List
Charli XCX and the 1975's George Daniel Give Caroline Polachek‘s ‘Welcome To My Island’ the Hyper-Pop Treatment,https://www.rollingstone.com/music/music-news/caroline-polacheks-welcome-to-my-island-charli-xcx-1975-george-daniel-remix-1234664881/,"The song will appear on Polachek's upcoming sophomore albumDesire, I Want To Turn Into You,out February 14",It's The Remix
How boygenius Replicated Rolling Stone's 1994 Nirvana Cover,https://www.rollingstone.com/music/music-news/boygenius-nirvana-cover-story-suits-1234662292/,"Photographer Ryan Pflugler, stylist Jared Ellner, and vintage fashion specialist Alexandra Mitchell break down the remake — and where you can find boygenius Easter eggs",About a Boygenius
Ed Sheeran Pays Tribute to Jamal Edwards With Emotional Performance,https://www.rollingstone.com/music/music-news/ed-sheeran-jamal-edwards-tribute-1234664851/,"'Lately I've been crying so much my lungs ache,' Sheeran raps in a powerful tribute to his late friend",Musical Remembrance
Neil Young Honors David Crosby: ‘I Remember the Best Times’,https://www.rollingstone.com/music/music-news/neil-young-honors-david-crosby-1234664838/,"""Crosby was a very supportive friend in my early life,"" Young wrote about his former CSNY bandmate. ""We bit off big pieces of our experience together""",Tribute
Metallica Unleash ‘Taboo’-Shattering New Song ‘Screaming Suicide’,https://www.rollingstone.com/music/music-news/metallica-new-song-screaming-suicide-1234664779/,"""The intention is to communicate about the darkness we feel inside,"" James Hetfield said of latest72 Seasonssingle",'You Are Not Alone'
"Yes, Ariana Grande Is Still a Singer. She's Literally Filming a Musical",https://www.rollingstone.com/music/music-news/ariana-grande-a-cappella-somewhere-over-the-rainbow-1234664751/,"Amidst herWickedduties, pop star tried to quell fan concerns with a rendition of ""Somewhere Over the Rainbow""",Wickedly Good
Hauser Gives ‘The Phantom of the Opera’ Theme a Dramatic Cello Revamp,https://www.rollingstone.com/music/music-news/hauser-cello-rendition-phantom-of-the-opera-theme-1234664677/,"The celebrated Croatian cellist shared his new recording, and music video, in honor of the hit musical's 35th anniversary",Cello Chops
"Dolly Parton, Gloria Estefan, Cyndi Lauper, Belinda Carlisle, Debbie Harry Release New Song ‘Gonna Be You’",https://www.rollingstone.com/music/music-news/dolly-parton-gloria-estefan-cyndi-lauper-belinda-carlisle-debbie-harry-new-song-1234664705/,Diane Warren-penned all-star collaboration features in new film80 for Brady,Supergroup
Meet Me @ the Altar Announce Debut Album ‘Past // Present // Future’ on ‘Colbert’,https://www.rollingstone.com/music/music-news/meet-me-at-the-altar-debut-album-past-present-future-announcement-1234664245/,"The record, featuring the pop punk band's latest single ""Say It (To My Face)"" arrives on March 10",Meet Me @ the Album
Sam Smith Shares Title Track From Upcoming LP ‘Gloria’: ‘My Queer Love Hymn’,https://www.rollingstone.com/music/music-news/sam-smith-new-song-gloria-1234664233/,The singer is set to serve as musical guest on this weekend's episode ofSaturday Night Live,'Life Is a Song'
Kim Petras Is Cold As Ice on Edgy New Single ‘Brrr’,https://www.rollingstone.com/music/music-news/kim-petras-brr-single-1234664211/,"After making history in 2022, Petras has said she's working on a new album that will be released this year",Ice Queen
BTS Star J-Hope’s Documentary ‘J-Hope in the Box’ Release Date Confirmed,https://www.rollingstone.com/music/music-news/bts-j-hope-documentary-j-hope-in-the-box-release-date-1234664616/,"The film will chronicle the making of the singer's first solo albumJack In The Box, as well as his history-making performance at Lollapalooza",Behind-the-Scenes
Joey Bada$$ Delivers Melodic Cover of Mos Def’s ‘UMI Says’,https://www.rollingstone.com/music/music-news/joey-badass-cover-mos-def-umi-says-1234664505/,"The rapper stopped by Australian radio station Triple J to also perform his own original track ""Show Me""",Hat Tip
Stephen Stills: David Crosby‘s ’Harmonic Sensibilities Were Nothing Short of Genius',https://www.rollingstone.com/music/music-news/stephen-stills-david-crosbys-tribute-1234664541/,"Former bandmate remembers ""the glue that held us together as our vocals soared, like Icarus, towards the sun""",Tribute
David Crosby's Final Live Performance Was a Blistering ‘Ohio’ With Jason Isbell,https://www.rollingstone.com/music/music-news/david-crosby-final-performance-jason-isbell-tribute-1234664393/,"""He was somebody who would challenge even the greatest of his peers,"" says Isbell, who brought out the folk-rock legend during a 2022 Santa Barbara concert",Tribute
Young Thug Allegedly Handed Percocet By Co-Defendant in Court,https://www.rollingstone.com/music/music-news/young-thug-percocet-handoff-court-ysl-rico-trial-atlanta-1234664389/,"The rapper ""does not even know"" the co-defendant who handed him the pill and was “cleared” of any wrongdoing, his lawyer tellsRolling Stone",Courts & Crime
Graham Nash Remembers David Crosby and the ‘Pure Joy of the Music’ They Created,https://www.rollingstone.com/music/music-news/graham-nash-remembers-david-crosby-1234664323/,"""What has always mattered to David and me more than anything was the pure joy of the music we created together,"" said Nash",Tribute
"David Crosby, Iconoclastic Rocker, Dead at 81",https://www.rollingstone.com/music/music-news/david-crosby-dead-obituary-1234664235/,"Croz was inducted into the Rock & Roll Hall of Fame as a member of both the Byrds and Crosby, Stills, and Nash",OBITUARY
Kali Uchis Removes Someone From Her Life But Not From Her Heart on ‘I Wish You Roses’,https://www.rollingstone.com/music/music-news/kali-uchis-i-wish-you-roses-1234664167/,"“It could be a friend, a lover, or someone else, but the point is to celebrate releasing people from your life without being resentful or bitter,"" Uchis shared",Valentine's Blues
Caroline Rose Learns ‘the Art of Forgetting’ as They Announce New Album,https://www.rollingstone.com/music/music-news/caroline-rose-announces-art-of-forgetting-1234664098/,"""I feel like a new version of myself. I think one for the better,"" they say of creating new music",Heartbreak Lesson
Dolly Parton’s New Song ‘Don’t Make Me Have to Come Down There’ Was a Gift From Her Dreams,https://www.rollingstone.com/music/music-news/dolly-parton-dont-make-me-have-to-come-down-there-birthday-single-1234664068/,"Released on her 77th birthday, the song was inspired by a dream the country icon had about God.",Birthday
"100 Gecs Map Out North American Tour in Support of ‘10,000 Gecs’",https://www.rollingstone.com/music/music-news/100-gecs-2023-north-american-tour-1234664081/,Hyperpop duo's much-anticipated second LP arrives March 17,Live Gecs
The Kid Laroi Reflects on His Past Mistakes in Deeply Personal Single ‘I Can't Go Back to the Way It Was (Intro)’,https://www.rollingstone.com/music/music-news/the-kid-laroi-drops-i-cant-go-back-to-the-way-it-was-1234664011/,"""I Can't Go Back to the Way It Was"" is the first release from singer's upcoming album",Lookin' Back
C.M. Talkington Enlists Renee Zellweger for New Single ‘Two Steps’,https://www.rollingstone.com/music/music-news/c-m-talkington-renee-zellweger-new-song-two-steps-1234663887/,Filmmaker-turned-singer/songwriter announces upcoming second albumTexas Radio,'Turn It Up!'
BTS‘ Jin Shares New Photo in Military Uniform as He Completes Basic Training: ‘I’m Having Fun',https://www.rollingstone.com/music/music-news/bts-jin-updates-army-on-military-service-1234663792/,The BTS member is the first in the group to enlist during their hiatus scheduled to conclude in 2025,Commander Jin
Pink Floyd Announce Massive ‘Dark Side of the Moon’ 50th Anniversary Box Set,https://www.rollingstone.com/music/music-news/pink-floyd-dark-side-of-the-moon-50th-anniversary-box-set-1234663778/,"Legendary 1973 LP accompanied by unreleased full-album performance, hardcover book, songbook, replica 7"" singles, and more",Money
Watch Hayley Williams Crash boygenius' Rolling Stone Cover Shoot,https://www.rollingstone.com/music/music-news/boygenius-hayley-williams-behind-the-scenes-cover-shoot-1234662297/,"The trio of Julien Baker, Phoebe Bridgers, and Lucy Dacus take us behind the scenes as they reinterpret a classic Nirvana cover shoot",Genius Business
Taeyang and BTS‘ Jimin Amp Up ’Vibe' With Band-Backed Live Performance Video,https://www.rollingstone.com/music/music-news/taeyang-bts-jimin-vibe-live-performance-1234663762/,The pair were joined by a six-piece band to reimagine Jimin's first official solo release since BTS began its hiatus,Catch A Vibe
"Fall Out Boy, Now a Trio, Debut New Single ‘Love From the Other Side’ on Kimmel",https://www.rollingstone.com/music/music-news/fall-out-boy-trio-love-from-the-other-side-kimmel-1234663736/,The performance taped hours before guitarist Joe Trohman announced his temporary departure from the band,Late-Night Jams
Rapper T.I. and Tiny Claim Toymaker Made ‘Millions of Dollars’ From OMG Girlz,https://www.rollingstone.com/music/music-news/t-i-tiny-trial-lawsuit-lol-surprise-dolls-omg-girlz-1234662580/,The all-girl musical act features Tiny's daughter Zonnique Pullins and even included Lil Wayne's daughter Reginae Carter at its inception,'Economic Justice'
"J. Cole Looks Up His Own Name, Releases Surprise Song ‘Procrastination (Broke)’",https://www.rollingstone.com/music/music-news/j-cole-releases-procrastination-broke-1234663640/,"The rapper wrote the new song over a ""J. Cole type beat"" he found on YouTube by producer Bvtman",YouTube Magic
Fall Out Boy Guitarist Joe Trohman Announces Hiatus From the Band,https://www.rollingstone.com/music/music-news/fall-out-boy-guitarist-joe-trohman-announces-hiatus-1234663642/,"""I must disclose that my mental health has rapidly deteriorated over the past several years,"" Trohman wrote in a post",Hiatus
Tory Lanez Regrets Not Testifying at Megan Thee Stallion Shooting Trial: Source,https://www.rollingstone.com/music/music-news/tory-lanez-megan-thee-stallion-shooting-trial-suge-knight-david-kenner-1234663426/,"The ""Luv"" singer is preparing a motion for a new trial as Suge Knight weighs in on defense team",Courts & Crime
Kesha Teases New 2023 Music While Eating Lunch,https://www.rollingstone.com/music/music-news/kesha-teases-new-music-instagram-1234663482/,Singer went on Instagram Live to share a snippet of new music,Kesha's Back
Flo Rida Wins $82.6 Million Lawsuit Against Energy Drink Company Celsius,https://www.rollingstone.com/music/music-news/flo-rida-wins-lawsuit-energy-drink-celsius-1234663410/,Rapper successfully argued the company failed to pay him what he was owed as part of an endorsement deal,Drink Up
Kelly Clarkson Somehow Made Joji's Emotional Ballad ‘Glimpse of Us’ Even More Heartbreaking,https://www.rollingstone.com/music/music-news/kelly-clarkson-jojis-glimpse-of-us-cover-1234663337/,The song isthe Kelly Clarkson showhost's latest Kellyoke pick of the season,Kellyoke Sad Girl Edition
Skrillex Continues Singles Streak With Bobby Raps-Assisted Song ‘Leave Me Like This’,https://www.rollingstone.com/music/music-news/skrillex-leave-me-like-this-single-release-1234663172/,"The record follows recent collaborations with Pinkpantheress and Trippie Redd on ""Way Back"" and with Fred Again.. and Flowdan on ""Rumble""",Hot Streak
Michael Jackson Biopic Taps Antoine Fuqua to Direct,https://www.rollingstone.com/music/music-news/michael-jackson-biopic-antoine-fuqua-director-1234663176/,Jackson estate-approved project will begin production this year,King of Pop
"Van Conner, Screaming Trees Co-Founder and Bassist, Dead at 55",https://www.rollingstone.com/music/music-news/van-conner-screaming-trees-dead-at-55-1234663111/,"Bassist died of “extended illness” and contracted pneumonia, his brother and bandmate Gary Lee said",Obituary
Rebecca Black Talks Creative Reintroduction Behind the Scenes at ‘Sick to My Stomach’ Video Shoot,https://www.rollingstone.com/music/music-news/rebecca-black-sick-to-my-stomach-music-video-behind-the-scenes-1234663030/,"""I'm in a really important part of my career right now,"" the singer toldRolling Stoneon set for her latest single. ""I'm here to reposition myself. I'm determined to show people what I have to offer""",Behind the Scenes
The National Recruit Three Special Guests for New Album ‘The First Two Pages of Frankenstein',https://www.rollingstone.com/music/music-news/the-national-new-album-the-first-two-pages-of-frankenstein-1234663099/,"The album, out April 24, will feature appearances from Taylor Swift, Phoebe Bridgers, and Sufjan Stevens",The Band is Back
Wednesday Are Getting Into Gloriously ‘Stupid Sh-t’ on ‘Chosen to Deserve’,https://www.rollingstone.com/music/music-news/wednesday-new-album-rat-saw-god-chosen-to-deserve-1234663046/,"Asheville, North Carolina outfit's new song — inspired by Drive-By Truckers' ""Let There Be Rock"" — will appear on their next LP,Rat Saw God",🤘🤘🤘
Boygenius Are Back in Town to Save 2023,https://www.rollingstone.com/music/music-news/boygenius-reunite-new-music-the-record-1234659530/,"The indie supergroup of Julien Baker, Phoebe Bridgers, and Lucy Dacus will finally release their debut album this spring",Sheer Genius
Snail Mail Plots Spring U.S. Tour,https://www.rollingstone.com/music/music-news/snail-mail-2023-spring-us-tour-dates-1234663033/,Lindsey Jordan follows hometown residency with 24-date trek that includes performing at Coachella,New Tour
"Fall Out Boy Announce First Album in 5 Years, Share ‘Love From The Other Side’ Video",https://www.rollingstone.com/music/music-news/fall-out-boy-love-from-the-other-side-video-so-much-for-stardust-announcement-1234662915/,"The song will appear on the band's forthcoming eighth studio albumSo Much (For) Stardust, out March 24",Sprinkle of Stardust
Rare Fugazi Live Footage Stitched Into New Movie to Screen One Night Only in Washington D.C.,https://www.rollingstone.com/music/music-news/rare-fugazi-live-footage-new-movie-1234662910/,"We Are Fugazi From Washington, DCboasts crowdsourced clips of the hardcore group, including some from filmmaker Lance Bangs",Screening Room
A$AP Rocky Wonders How to Break Violent Cycles in Hip-Hop on Tribute Single ‘Same Problems',https://www.rollingstone.com/music/music-news/asap-rocky-same-problems-single-release-1234662866/,"The rapper first premiered the record during an Amazon Music Live show, using the visual elements to pay tribute to Takeoff, Juice WRLD, A$AP Yams, and more",Making a Change
Lisa Marie Presley's Cause of Death Deferred by Coroner Pending ‘More Investigation’,https://www.rollingstone.com/music/music-news/lisa-marie-presley-cause-of-death-1234660808/,The daughter of Elvis and Priscilla Presley died at age 54 after being treated for cardiac arrest in her Calabasas home on Jan. 12,Cause of Death
Soccer Mommy Performs Career-Spanning Show for NPR's ‘Tiny Desk’,https://www.rollingstone.com/music/music-news/soccer-mommy-npr-tiny-desk-1234662714/,The indie rock singer was the first artist to have to cancel her appearance due to the pandemic back in 2020,Performance Mommy
Adi Oasis Channels High Fashion and Euphoria in Video for Ovulation Anthem ‘Multiply’,https://www.rollingstone.com/music/music-news/adi-oasis-multiply-video-lotus-glow-1234662817/,"""'Multiply' is about that very real thing that happens to many women when their hormones start saying 'I want a baby,'"" Adi Oasis tellsRolling Stone. ""It can be purely hormonal, or desperately romantic""",Desperately Romantic
Cardi B Recalls the Moment She and Offset Learned of Takeoff's Death: ‘I Was So Scared’,https://www.rollingstone.com/music/music-news/cardi-b-remembering-takeoff-death-1234662563/,The rap couple was meant to attend a Halloween party the night the Migos rapper was shot and killed at a bowling alley in Houston,Remembering Takeoff
Taylor Swift and SZA Officially Shut Down Feud Rumors: ‘So Much Love and Respect’,https://www.rollingstone.com/music/music-news/taylor-swift-sza-shut-down-fued-rumors-1234662557/,"Stans, don't start shit",SZA ❤️ Tay
"2023 Lovers & Friends Festival Fully Leans Into 2000s Nostalgia With Missy Elliott, Usher, Mariah Carey",https://www.rollingstone.com/music/music-news/lovers-and-friends-festival-2023-lineup-1234662533/,"Busta Rhymes, Flo Rida, Nelly, Pitbull, Christin Aguilera, Lil Kim, Omarion, Bow Wow, JoJo and more will perform at the Las Vegas festival on May 6, 2023",Throwback Festival
New York Lawmakers Protest Madison Square Garden Over Facial Recognition Controversy,https://www.rollingstone.com/music/music-news/new-york-senate-madison-square-garden-face-scanning-1234662270/,"""It is absolutely time for the city and the state to reconsider any and all permits, licenses, and benefits provided to MSG in the face of their continued malfeasance,"" one New York State Senator said regarding the venue's controversial policy","Face Off, Square Up"
Lil Yachty Ready to Get Going With New Album ‘Let’s Start Here',https://www.rollingstone.com/music/music-news/lil-yachty-new-album-lets-start-here-release-date-1234662491/,Rapper's first proper solo album in three years will arrive by the end of January,Lil Boat's Back
Mastodon and Gojira Announce ‘The Mega-Monsters' Co-Headlining Tour,https://www.rollingstone.com/music/music-news/gojira-mastodon-mega-monsters-co-headlining-tour-1234662396/,Lorna Shore will support all dates across both tour legs scheduled to begin in April,2 for 1
Security Guards at London Venue Where Two Died in Crowd Crush Allegedly Took Bribes to Let People In,https://www.rollingstone.com/music/music-news/guards-accused-taking-bribes-asake-o2-academy-brixton-crush-killed-two-1234662424/,"Security company whistleblower said members of his team often let in ""a couple of hundred"" extra people to shows in exchange for cash",Crowd Crush
Yeah Yeah Yeahs and MGMT Headline Just Like Heaven Festival,https://www.rollingstone.com/music/music-news/just-like-heaven-lineup-yeah-yeah-yeahs-mgmt-1234662330/,"Future Islands, M83, Empire of the Sun, Azaelia Banks, and other artists are featured on the lineup",Dance to the Beat
