title,link,summary,category
A 'B.A.P.S.' Remake Could Happen — But Cardi B and Megan Thee Stallion Won't be in It,https://www.rollingstone.com/music/music-news/cardi-b-denies-baps-remake-rumors-megan-thee-stallion-1234693658/,"“I don’t even know where that rumor even came about,"" Cardi B wrote after the film's original director suggested the pair expressed interest in the film",W.A.P.S not B.A.P.S.
Lewis Capaldi Grows Anxious Under Pressure in 'How I'm Feeling Now' Trailer,https://www.rollingstone.com/music/music-news/lewis-capaldi-documentary-how-im-feeling-now-heading-to-netflix-1234693464/,The documentary arrives to Netflix on April 5,Racing Against the Clock
"For The First Time In Decades, People Bought More Vinyl Than CDs Last Year",https://www.rollingstone.com/music/music-news/riaa-vinyl-units-surpass-cds-1234693223/,"Vinyl sold more units than CDs in 2022, according to a year-end report from the Recorded Industry Association of America",Positive Spin
Ed Sheeran Will Explore Grief on 'Subtract' Single 'Eyes Closed': 'I Guess Music Helps Heal',https://www.rollingstone.com/music/music-news/ed-sheeran-preview-subtract-eyes-closed-snippet-1234693437/,The album arrives May 5 with the first single coming March 24,Dancing in the Dark
The Cure Set First North American Tour in Seven Years,https://www.rollingstone.com/music/music-news/the-cure-north-american-tour-2023-1234693447/,"""There will be no 'platinum' or 'dynamically priced' tickets on this tour,"" Robert Smith and company pledge of 34-date trek",Just Like Heaven
GloRilla Concert Venue Where 2 Died in Crowd Surge Has License Revoked by Rochester Police,https://www.rollingstone.com/music/music-news/rochester-police-revoke-license-venue-crowd-surge-glorilla-concert-1234693430/,"“It is one step we can immediately take to ensure that the events of Sunday night are not repeated,” Rochester police chief David Smith said",'Not Repeated'
"Christine and the Queens Enlist Madonna, 070 Shake for New Album 'Paranoïa, Angels, True Love'",https://www.rollingstone.com/music/music-news/christine-and-the-queens-madonna-070-shake-new-album-paranoia-angels-true-love-1234693100/,The triple-LP follow-up to 2022'sRedcar les Adorables Étoilearrives June 9,Queens
Rolling Stone Brings the Future of Music to Life With A Four-Night SXSW Showcase,https://www.rollingstone.com/music/music-news/future-of-music-sxsw-1234691885/,"ROLLING STONE is taking over SXSW 2023 with a massive four-night lineup. Officially titled Future of Music, the event boasts an astounding 20-act showcase with 5 acts per night from March 14 through March 17. Taking place at the iconic ACL Moody Theater, a 2,750-person capacity state-of-the-art live music venue, the space is a quintessential […]",
Your Spotify Feed Is About to Look More Like TikTok,https://www.rollingstone.com/music/music-news/spotify-is-going-to-look-more-like-tiktok-1234692793/,"The streaming platform's vertical interface includes previews, ""advanced recommendations,"" video and animated images",Streaming
Janet Jackson to Chronicle Upcoming Tour for New Documentary 'Family First',https://www.rollingstone.com/music/music-news/janet-jackson-new-documentary-family-first-1234693055/,"The follow-up to last year'sJanet Jacksonwill also look at her efforts to reunite the family band with her brother, Randy Jackson",Family First
"J.I.D., Jay Wheeler, Remi Wolf, Koffee, and More to Play Rolling Stone's Future of Music Showcase at SXSW",https://www.rollingstone.com/music/music-news/rolling-stone-future-of-music-sxsw-showcase-lineup-1234692135/,"Cuco, Mariah the Scientist, Saba, Chlöe Bailey, and other rising stars will also appear at the four-day event in Austin, part of our ongoing Future of Music series",SXSW 2023
"Bruno Mars, Brandi Carlile, the Killers Lead 2023 Bourbon & Beyond Fest",https://www.rollingstone.com/music/music-news/bruno-mars-brandi-carlile-the-killers-2023-bourbon-and-beyond-fest-1234692932/,"Duran Duran, Black Keys, Billy Strings, Black Crowes, Blondie, and more also tapped for four-day festival in Louisville, Kentucky",Festival SZN
"Jane's Addiction Debut Their First New Song in 10 Years, 'True Love'",https://www.rollingstone.com/music/music-news/janes-addiction-debut-new-song-true-love-1234692786/,"The band closed out a recent show in Bakersfield, California, with the psych-tinged ballad",Jane Says
Lucy Dacus Revisits 'Night Shift' Heartbreak Five Years Later in Official Music Video,https://www.rollingstone.com/music/music-news/lucy-dacus-night-shift-music-video-1234692665/,The song appeared on the singer's 2017 sophomore albumHistorian,Better Late Than Never
"World's Largest Talent Agencies, Music Companies Co-Sign Live Nation's Call for Anti-Scalping Laws",https://www.rollingstone.com/music/music-news/live-music-companies-co-sign-live-nation-anti-scalping-laws-1234692406/,"Over 20 companies including CAA, WME, Universal Music Group and Full Stop Management announced their support of the live music giant's push for artist-minded ticketing laws",Ticket War
Lil Keed's First Posthumous LP 'Keed Talk to 'Em 2' Arriving This Month,https://www.rollingstone.com/music/music-news/lil-keed-first-posthumous-lp-keed-talk-to-em-2-track-list-self-employed-1234692705/,"YSL Records drops video for ""Self Employed"" ahead of album's March 17 release",RIP KEED
"Real Earth, Wind & Fire Sues Fake Earth, Wind & Fire for Trademark Infringement, Deceiving Fans",https://www.rollingstone.com/music/music-news/earth-wind-and-fire-copyright-infringement-lawsuit-1234692630/,"Funk legends' rights holders file lawsuit against company operating an EWF ""legacy reunion,"" accusing them of ""misleading consumers""","Earth, Wind & Liar"
Monsta X and Jessi Added to Inaugural We Bridge Music Festival Lineup,https://www.rollingstone.com/music/music-news/we-bridge-music-festival-2023-enhypen-kang-daniel-1234670605/,The artists join previously announced performers ENHYPEN and Kang Daniel at the three-day Las Vegas event that celebrates the best in Asian entertainment and culture,K-POP IN VEGAS
RM Is Confident About BTS Eventually Reuniting — But Knows 'Nothing Lasts Forever',https://www.rollingstone.com/music/music-news/rm-discusses-bts-future-military-enlistment-1234692595/,"""I think BTS will make it. It will come together again when we finish our military service, and we will look for new synergies between us to enter a second phase,"" the singer shared in a recent interview",BTS Will Make It
Harry Styles Brings Back the 'Banana Song' — And Gives the Tune a Veggie-Inspired Remix,https://www.rollingstone.com/music/music-news/harry-styles-brings-back-banana-song-1234692567/,"Singer also addressed his viral moment from the weekend, where he posted and then deleted a photo of himself wearing a One Direction shirt",Veggie Tunes
GloRilla Concert Venue Was Known Locally as a ‘Death Trap.' Now It’s Actually Become One,https://www.rollingstone.com/music/music-news/glorilla-rochester-concert-stampede-1234692068/,"Fans who attended the Rochester, New York show had heard rumors about the venue's safety practices, but they didn't think a night out would leave two dead and eight others injured",Crowd Hysteria
Rufus Wainwright Previews New LP With 'Masochistic' Folk Ballad Featuring Brandi Carlile,https://www.rollingstone.com/music/music-news/rufus-wainwright-brandi-carlile-down-in-the-willow-garden-1234692313/,"The singer-songwriter's upcoming albumFolkocracyfeatures an all-star cast including John Legend, David Byrne, and more",'Blatantly Brutal'
Suga's Solo Tour Tickets Are Selling Out Fast — Here's How You Can Still See the BTS Member's Concert,https://www.rollingstone.com/music/music-news/buy-suga-agust-d-tour-tickets-online-1234692236/,"The first BTS member to hit the road solo, here's where you can still buy tickets to Suga's sold-out Agust D world tour online",SUGA GOES SOLO
"Kid Cudi, 21 Savage Top 2023 Hard Festival Lineup",https://www.rollingstone.com/music/music-news/hard-festival-2023-lineup-kid-cudi-21-savage-skrillex-1234692028/,"L.A. fest will also feature Skrillex back-to-back with Four Tet, Dillon Francis, Ludacris, Fat Joe, and more",Go Hard
"Jason Isbell, Allison Russell, Sheryl Crow to Perform for LGBTQ+ Rights at Tennessee Concert",https://www.rollingstone.com/music/music-news/tennessee-lgbtq-laws-drag-ban-benefit-concert-jason-isbell-sheryl-crow-1234692045/,"Paramore's Hayley Williams, Brothers Osborne, Hozier and more are on the bill at ""Love Rising Tennessee,"" which takes place amid a flurry of anti-LGBTQ+ laws being enacted in the state",Human Rights
"Foo Fighters, Kendrick Lamar Lead Outside Lands Lineup",https://www.rollingstone.com/music/music-news/foo-fighters-kendrick-lamar-outside-lands-headliners-lineup-1234692054/,"Odesza, Lana Del Rey, the 1975, and Megan Thee Stallion among the artists set for San Francisco fest",Outside Lands Lineup
Dave Grohl Put in 18 Hours on the Grill – Again – to Feed Underserved Communities in L.A.,https://www.rollingstone.com/music/music-news/dave-grohl-feed-the-streets-homeless-watch-1234692003/,"Last week, the Foo Fighters leader fed more than 500 people at a homeless shelter in Los Angeles",Giving Back
"The 'Elvis' Soundtrack Deluxe Edition Has More Austin Butler Voice, a Deranged Backstreet Boys Mashup",https://www.rollingstone.com/music/music-news/elvis-soundtrack-austin-butler-backstreet-boys-1234691973/,"The 52-song set features Butler's takes on several Presley classics and a wild remix of ""Backstreet's Back"" with ""Bossa Nova Baby""",Even More Elvis
"Red Hot Chili Peppers, John Mayer, Alanis Morissette to Headline 'Sound on Sound' Festival",https://www.rollingstone.com/music/music-news/red-hot-chili-peppers-john-mayer-alanis-morissette-headline-sound-on-sound-festival-1234691955/,"Hozier, Mt. Joy, Lord HUron, Joy Oladokun, Margo Price, Cautious Clay, and more will also perform",Festival Season
Angel Olsen Returns With New Single 'Nothing's Free' From Upcoming EP,https://www.rollingstone.com/music/music-news/angel-olsen-new-single-nothings-free-forever-means-ep-1234691156/,"Forever Means, out April 14, features four tracks culled from the sessions of the singer's acclaimed 2022 LPBig Time",Bigger Time
"Taylor Swift, Pink Receiving Special Honors at 2023 iHeartRadio Awards",https://www.rollingstone.com/music/music-news/taylor-swift-pink-special-honors-2023-iheartradio-awards-1234691852/,"Pink will also perform at this year's show, along with Coldplay, Kelly Clarkson, and more",iHeart Awards
Chance the Rapper Brings Enthusiastic 'Yah Know' Performance to 'Fallon',https://www.rollingstone.com/music/music-news/chance-the-rapper-performs-yah-know-the-tonight-show-1234691825/,The song will appear on rapper's forthcoming projectStar Line Gallery,The Tonight Show
Miley Cyrus Bringing Day and Night Energy to 'Endless Summer Vacation',https://www.rollingstone.com/music/music-news/miley-cyrus-endless-summer-vacation-two-parts-am-pm-1234691644/,"The pop star explained that her new album is split into two parts, ""a.m."" and ""p.m.""",Dusk and Dawn
Loved Ones Mourn GloRilla Concert Stampede Victims: 'You Did Not Deserve This',https://www.rollingstone.com/music/music-news/glorilla-concert-victim-rhondesia-belton-tribute-remembrance-1234691590/,"Three women – Rhondesia Belton, Aisha Haskins, and Brandy Miller – died following a crowd surge at GloRilla's Rochester, New York concert on Sunday",Remembrance
Jin Gives ARMY an Army Update in New Photo With BTS Bandmates J-Hope and Jimin,https://www.rollingstone.com/music/music-news/bts-photo-j-hope-jimin-military-service-1234691595/,"Jin is the first member to fulfill his mandatory service requirements, while J-Hope will enlist next",Picture Perfect
Black Thought and El Michels Affair Embrace the 'Glorious Game' on New Song,https://www.rollingstone.com/music/music-news/black-thought-el-michels-affair-title-track-glorious-game-1234691537/,"Track, featuring guest vocals from Kirby, will appear on the pair's collaborative album of the same name",Let the Game Begin
"Lionel Richie Plots North American Tour With Earth, Wind & Fire",https://www.rollingstone.com/music/music-news/lionel-richie-earth-wind-and-fire-tour-dates-2023-1234691442/,"The ""Sing a Song All Night Long"" 20-date arena trek kicks off in August",Sing a Song
Hip-Hop at 50: Libraries Nationwide Plot Events to Celebrate Genre's History and Influence,https://www.rollingstone.com/music/music-news/hip-hop-at-50-libraries-special-events-anniversary-1234691386/,"The initiative, spearheaded by the Queens Public Library in NYC, kicked off last month and will continue through August",And You Don't Stop
"Jenny Lewis, Her Puppy, and Her Truck Will Hit the Road This Summer",https://www.rollingstone.com/music/music-news/jenny-lewis-summer-tour-1234691346/,The singer-songwriter also dropped a video for her 2021 yacht rock frenzy,Wasted Youth
Latin American Music Awards Returning to Las Vegas for 2023 Ceremony,https://www.rollingstone.com/music/music-news/2023-latin-american-music-awards-las-vegas-april-1234691369/,The event will be held on April 20,Latin AMAs
Billy Gibbons Remembers Lynyrd Skynyrd's Gary Rossington: 'He Was the Last of the Breed',https://www.rollingstone.com/music/music-news/billy-gibbons-lynyrd-skynyrd-gary-rossington-tribute-1234691328/,The ZZ Top frontman was slated to join the Skynyrd guitarist on the road this summer,Tribute
Three Women Dead Following Stampede at GloRilla Concert,https://www.rollingstone.com/music/music-news/glorilla-concert-stampede-death-injuries-1234691325/,"The surge appears to be sparked by unfounded reports of gunfire at the Main Street Armory in Rochester, New York. Seven other people were injured in the melee.",Concert Safety
"Selena Gomez Returns to Social Media, Says Her Heart Has Been 'Heavy' Amid Hailey Bieber Drama",https://www.rollingstone.com/music/music-news/selena-gomez-returns-to-social-media-following-hailey-bieber-drama-1234691293/,"Nearly two weeks ago, Selena Gomez announced she would be taking a break from social media following a brief and indirect back-and-forth with Hailey Bieber",'Be Kinder'
Miley Cyrus Reviving the 'Backyard Sessions' for 'Endless Summer Vacation' Special,https://www.rollingstone.com/music/music-news/miley-cyrus-backyard-sessions-endless-summer-vacation-1234690323/,"Singer-songwriter will play ""The Climb,"" songs off her new album, and collaborate with Rufus Wainwright on new Disney+ special",Backyard's Back
Watch Smashing Pumpkins Cover Joy Division's 'No Love Lost' With Peter Hook,https://www.rollingstone.com/music/music-news/smashing-pumpkins-joy-division-no-love-lost-peter-hook-1234691163/,"Jack Bates, Hook's son, pulls double-duty as bassist of both the Smashing Pumpkins and Peter Hook & The Light at Mexico City's World Is a Vampire fest",Live Transmission
Justin Bieber Makes Surprise Appearance at Don Toliver's Rolling Loud Gig,https://www.rollingstone.com/music/music-news/justin-bieber-don-toliver-rolling-loud-1234691122/,"Singer performs ""Private Landing"" with Toliver just days after canceling the postponed Justice World Tour",Biebz Back Onstage
Watch Lil Uzi Vert Get Slimed at the Nickelodeon Kids Choice Awards,https://www.rollingstone.com/music/music-news/lil-uzi-vert-slime-nickelodeon-kids-choice-awards-1234691106/,Lil Baby and Bebe Rexha also deliver slime-free performances at the kid-friendly award show,Slime Time
Kelsea Ballerini Drops New Divorce-Inspired Lyrics in Smashing SNL Debut,https://www.rollingstone.com/music/music-news/kelsea-ballerini-snl-debut-divorce-lyrics-blindsided-penthouse-rolling-up-the-welcome-mat-1234690701/,Singer-songwriter performed new music from herRolling Up the Welcome MatEP,SOARING
"Watch Phoebe Bridgers, Cardi B Join SZA for Madison Square Garden Performance",https://www.rollingstone.com/music/music-news/sza-phoebe-bridgers-cardi-b-madison-square-garden-performance-watch-1234691046/,SZA and Bridgers performed “Ghost in the Machine” for first time live on Saturday,SZA @ MSG
SST Records Producer Glen ‘Spot’ Lockett Dead at 72,https://www.rollingstone.com/music/music-news/glen-spot-lockett-sst-records-producer-dead-obit-1234691019/,"Musician, engineer, photographer, and writer helmed records by Black Flag, Minutemen, and Descendents",Obituary
Glastonbury Co-Organizer Promises Female Headliners in 2024 After All-Male Top Billing This Year,https://www.rollingstone.com/music/music-news/glastonbury-co-organizer-promises-female-headliners-2024-1234690964/,Lana Del Rey expresses disappointment after festival's marketing downplays her Other Stage appearance,'We'll See'
See the Beths Deliver Refreshing 'Expert in a Dying Field' Mini-Set on 'CBS Mornings',https://www.rollingstone.com/music/music-news/the-beths-cbs-mornings-saturday-sessions-1234690867/,"The on-tour New Zealand indie-pop band perform their latest album's title track, ""Your Side"" and ""When You Know You Know""",Saturday Sessions
The National Stay Up Late to Perform 'Tropic Morning News' on Fallon,https://www.rollingstone.com/music/music-news/the-national-tropic-morning-news-tonight-show-jimmy-fallon-1234690840/,The song is the band's lead single from their upcoming albumFirst Two Pages of Frankenstein,Late Night Jams
"David Lindley, Multi-Instrumentalist Who Shaped the Sound of Soft Rock, Dead at 78",https://www.rollingstone.com/music/music-news/david-lindley-dead-obituary-1234690754/,"Lindley collaborated with the likes of Jackson Browne, Dolly Parton, Bob Dylan, Bruce Springsteen, Toto, Rod Stewart, and Joe Walsh",Obituary
Suki Waterhouse Won't Take Romance for Granted on New Single 'To Love',https://www.rollingstone.com/music/music-news/suki-waterhouse-new-song-to-love-1234690705/,"""It is a very distinct portrait of my heart right now that I wanted to share,” the British musician shared in a statement",How Lucky We Are
Travis Barker Says His Finger Ligament Surgery Was a 'Success' After Postponing Blink-182 Tour,https://www.rollingstone.com/music/music-news/travis-barker-finger-surgery-success-postponed-blink-182-tour-1234690605/,"""It was a hard decision to make but ultimately I couldn’t continue to play the drums without it,"" Barker said",Feeling Better
James Hetfield to Appear Alongside Peter Dinklage in Upcoming Western Thriller,https://www.rollingstone.com/music/music-news/metallica-james-hetfield-western-movie-role-1234690551/,"Production has begun on 'The Thicket,' which also stars Juliette Lewis",Some Kind of Actor
Bonnaroo Pledges to Remain a 'Safe Haven' in Face of Tennessee Anti-Drag Law,https://www.rollingstone.com/music/music-news/bonnaroo-statement-tennessee-anti-drag-law-1234690594/,"""Rest assured The Farm will remain a sanctuary for those freedoms and Bonnaroovians will see no changes in programming or celebration of self-expression""",'A Place for Inclusivity'
Cate Blanchett Suits Up and Gets Down in Sparks' New Music Video,https://www.rollingstone.com/music/music-news/cate-blanchett-sparks-girl-is-crying-in-her-latte-video-1234690536/,"The two-time Oscar-winner shows off her dance skills in the visual for ""The Girl Is Crying in Her Latte""",Cate the Great
Fall Out Boy's Weird Song Titles Are Back on 'So Much (For) Stardust' Tracklist,https://www.rollingstone.com/music/music-news/fall-out-boy-so-much-for-stardust-tracklist-1234690469/,"The album, which also features Ethan Hawke for some reason, will arrive March 24",Baby Annihilation
"Arctic Monkeys, Guns N' Roses, and Elton John Headline 2023 Glastonbury Festival",https://www.rollingstone.com/music/music-news/glastonbury-2023-arctic-monkeys-guns-n-roses-elton-john-headline-1234690447/,"Despite having no female headliners, artists such as Lana Del Rey, Lizzo, Rina Sawayama, Raye, and Carly Rae Jepsen are featured on the lineup",Fest SZN
Taylor Swift Plots a 'Seventies Powder Party' (Not That Kind) in 'Lavender Haze' Behind-the-Scenes Video,https://www.rollingstone.com/music/music-news/taylor-swift-behind-the-scenes-lavender-haze-video-1234690432/,New clip follows the pop star as she pulls double duty as actor and director on theMidnightsvisual,Making the Video
Jeff Goldblum Shows Off His Piano Skills on Jazz Classic 'A Baptist Beat',https://www.rollingstone.com/music/music-news/jeff-goldblum-piano-a-baptist-beat-1234690420/,"Actor takes on Hank Mobley classic on upcoming EPPlays Well With Others, featuring six of what Goldblum considers the best songs ever written",Gold Bop
Kelly Clarkson Continues Hot Streak With Death Cab for Cutie 'You Are a Tourist' Cover,https://www.rollingstone.com/music/music-news/kelly-clarkson-cover-death-cab-for-cutie-you-are-a-tourist-1234690292/,"Earlier this week, theKelly Clarkson Showhost took on songs from Spacehog, MUNA, Ingrid Andress, and Smashing Pumpkins",New Kellyoke
You Can't Walk in Her Crocs: Nicki Minaj Drops First Song of 2023 'Red Ruby Da Sleeze',https://www.rollingstone.com/music/music-news/nicki-minaj-new-song-red-ruby-da-sleeze-1234690245/,"The track marks the rapper's first proper solo single since last year's massive hit, ""Super Freaky Girl""",Return Of the Queen
Conor Oberst Teams Up With the So So Glos to Lament Our Forever War,https://www.rollingstone.com/music/music-news/conor-oberst-so-so-glos-everywhere-is-war-1234690194/,"""The song reflects on a world at war — whether it’s Nazis marching in Charlottesville or a conflict overseas""",Exclusive
'One Day You'll Be Cool': Hear the Big Opener '1973' From the 'Almost Famous' Musical,https://www.rollingstone.com/music/music-news/opening-number-1973-almost-famous-musical-1234690187/,The original cast recording for the show — which wrapped a short Broadway run in January — arrives in April,Sorta All Happening
Loren Gray Is Ready to Come 'Into My Own' on Debut Album 'Guilty',https://www.rollingstone.com/music/music-news/loren-gray-announces-album-guilty-1234690105/,"""I felt my most open, and that was my goal from the beginning of the writing process,"" she tellsRolling Stone",Exclusive
De La Soul's Beloved Albums Are Finally Streaming,https://www.rollingstone.com/music/music-news/de-la-soul-catalog-streaming-1234690167/,"After years of digital purgatory, the rap trio’s first six albums are now available, just weeks after the death of Trugoy the Dove",Bittersweet
Demi Lovato Is 'Still Alive' After Fighting Off Ghostface in 'Scream 6' Music Video,https://www.rollingstone.com/music/music-news/demi-lovato-still-alive-scream-vi-video-1234690064/,"Linkin Park's Mike Shinoda, who co-wrote the song, makes an appearance in the scary movie-themed visual",Final Girl
J-Hope and J. Cole Meet in the Middle for New Song 'On the Street',https://www.rollingstone.com/music/music-news/bts-j-hope-on-the-street-j-cole-1234689975/,The single arrives just days after it was announced the BTS member will soon begin the enlistment process to complete his mandatory military service in South Korea,J-Squared
Dijon Doesn't Know Whether to Bottle It Up or Let It Out on 'Coogie',https://www.rollingstone.com/music/music-news/dijon-new-song-coogie-1234689280/,"The track marks the singer-songwriter's first offering since his acclaimed 2021 album,Absolutely",Dijon Returns
Thalia Helps Kenia Os Heal From an Ex in 'Para No Verte Más' Video,https://www.rollingstone.com/music/music-news/thalia-kenia-os-para-no-verte-mas-video-1234690086/,"""Para No Verte Más"" is a revisit of La Mosca Tse-Tse's 1999 hit single of the same title",Thalia's New Era
Aaron Carter: Police Say 'No Evidence of Foul Play' as Mom Calls for a 'Real Investigation',https://www.rollingstone.com/music/music-news/aaron-carter-police-no-evidence-foul-play-mom-further-investigation-1234689992/,"Singer's mother shares disturbing ""death scene photos"" and laments that bathroom wasn't investigated as ""possible crime scene""",RIP
Ashnikko Enters a 'Post-Apocalyptic Fae World' as She Announces Debut Album 'Weedkiller',https://www.rollingstone.com/music/music-news/ashnikko-announces-debut-album-weedkiller-1234689872/,"The singer announced the album's tracklist, featuring a song with Ethel Cain, along with a U.S. tour",Fairy World
The Lumineers Announce Encore 'Brightside' Tour,https://www.rollingstone.com/music/music-news/the-lumineers-announce-2023-tour-1234689849/,The band will hit the road this fall for a string of shows,Bright Drive
Lea Michele's 'Funny Girl' Sets Final Performance Date,https://www.rollingstone.com/music/music-news/lea-michele-final-performance-date-set-1234689811/,The cast will head on the road for a tour later this year,Last Bow
Boygenius Debut Album Cut 'Cool About It' Live at Tibet House Benefit Concert,https://www.rollingstone.com/music/music-news/boygenius-perform-cool-about-it-at-tibet-house-benefit-concert-1234689623/,"The song will appear on the trio's upcoming albumThe Record, out March 31",Live Debut
"Wayne Shorter, Jazz Legend Who Collaborated With Miles Davis and Joni Mitchell, Dead at 89",https://www.rollingstone.com/music/music-news/wayne-shorter-jazz-legend-dead-obit-1234689732/,Prolific Grammy-winning saxophonist also recorded with Steely Dan and Herbie Hancock in addition to his own renowned albums and work with supergroup Weather Report,Obituary
New Coaches Niall Horan and Chance the Rapper Join 'The Voice' Vets for 'Can't Take My Eyes Off You' Cover,https://www.rollingstone.com/music/music-news/niall-horan-chance-the-rapper-kelly-clarkson-blake-shelton-frankie-valli-cant-take-my-eyes-off-you-cover-1234689638/,"Chance the Rapper, Kelly Clarkson, Niall Horan and Blake Shelton gathered for a performance of Frankie Valli's ""Can't Take My Eyes Off You"" ahead of the show's season 23 premiere",Voices of The Voice
