title,link,summary,category
"BTS’ RM's Announces Second Solo Album 'Right Place, Wrong Person'",https://www.rollingstone.com/music/music-news/bts-rm-announces-album-right-place-wrong-person-1235010626/,RM will drop the album on May 24,After Indigo
Travis Scott to Face Civil Trial as Judge Denies Dismissal From Astroworld Lawsuits,https://www.rollingstone.com/music/music-news/travis-scott-judge-denies-dismissal-astroworld-lawsuits-1235010607/,First of potentially many civil trials against rapper and Live Nation to begin May 6,astroworld
"Mike Pinder, the Moody Blues Keyboardist and Founding Member, Dead at 82",https://www.rollingstone.com/music/music-news/mike-pinder-the-moody-blues-keyboardist-founding-member-dead-obit-1235010490/,"A pioneer of the Mellotron, Pinder contributed to Rock Hall-inducted band's first nine albums, from their 1965 debut with Denny Laine to 1978'sOctave",Obituary
Machine Gun Kelly Isn't Dumb Enough to Cross Taylor Swift: I Don't 'Want Any Smoke' With Swifties,https://www.rollingstone.com/music/music-news/machine-gun-kelly-taylor-swift-fans-1235010422/,"The rapper faced off with Trippie Redd on Hot Ones Versus and picked the dare of eating a spicy wing over saying ""three mean things"" about Swift",Won't Take the Bait
"Billie Eilish, Lorde, Green Day Among Artists to Sign Letter in Support of Ticketing Reform Act",https://www.rollingstone.com/music/music-news/billie-eilish-lorde-green-day-fans-first-act-open-letter-1235010388/,"If passed, Fans First Act bill would crack down on ""predatory"" ticket resellers and illegal bots plaguing the concert industry",fix the tix
Donna Kelce Calls Taylor Swift's ‘The Tortured Poets Department’ Her 'Best Work',https://www.rollingstone.com/music/music-news/donna-kelce-taylor-swift-the-tortured-poets-department-best-work-1235010328/,"""She is a very talented woman,"" she said of her son Travis Kelce's girlfriend",High Praise
"Kelly Clarkson Celebrates Birthday With Heart, Sings 'Crazy On You' and 'Magic Man'",https://www.rollingstone.com/music/music-news/kelly-clarkson-birthday-heart-crazy-on-you-magic-man-1235010205/,"The singer spent a full hour with the sisters during her talk show, sharing stories and performing their classics",Heart-to-Heart
Kanye West Announces 'Yeezy Porn' Amid Reports of Adult Film Company,https://www.rollingstone.com/music/music-news/kanye-west-yeezy-porn-reports-adult-film-company-1235010164/,West has reportedly been in talks with Stormy Daniels' ex-husband Mike Moz to head the adult entertainment venture,Here We Go
Kim Petras Cancels Summer Fest Appearances Due to Health Concerns: 'I'm Devastated',https://www.rollingstone.com/music/music-news/kim-petras-cancels-summer-festival-appearances-health-issues-1235010025/,"""I love u so much and I’ll make it up to you and be back better than ever very soon,"" the artist writes on social media",Get Well Soon
Tupac Estate Demands Drake Take Down 'Taylor Made Freestyle' Over AI Vocals,https://www.rollingstone.com/music/music-news/tupac-estate-drake-remove-taylor-made-freestyle-ai-voice-1235009865/,"A cease-and-desist letter called the track a ""flagrant violation of Tupac’s publicity and the estate’s legal rights""",Clone Wars
Takeoff to Be Posthumously Featured on Ye and Ty Dolla $ign's 'Vultures 2',https://www.rollingstone.com/music/music-news/takeoff-featured-kanye-west-ty-dolla-sign-vultures-2-source-1235009767/,"The late rapper gets a verse on a song tentatively titled ""Let Me Chill Out,"" which also features Rich the Kid and NBA Youngboy, a source tellsRolling Stone",Exclusive
Madison Beer Channels 'Jennifer's Body' in Obsessively Possessive 'Make You Mine' Video,https://www.rollingstone.com/music/music-news/madison-beer-make-you-mine-video-1235009785/,The singer and songwriter co-directed the four-minute flick with Aerin Moreno while also slipping into the role of Megan Fox's Jennifer,Bi-Panic
Kid Cudi Cancels Tour After Breaking Foot at Coachella: 'Injury Is Much More Serious Than I Thought',https://www.rollingstone.com/music/music-news/kid-cudi-cancels-insano-tour-foot-surgery-coachella-injury-1235009845/,"“I’m headed to surgery now and there’s gonna be a long recovery time,"" rapper writes",healing time
Billy Corgan Sets Unscripted TV Series Centering on His Role as Wrestling Company Owner,https://www.rollingstone.com/music/music-news/billy-corgan-unscripted-tv-series-wrestling-company-owner-1235009829/,"Billy Corgan’s Adventures in Carnylandfollows Smashing Pumpkins frontman as he balances family life,  rock stardom, and the National Wrestling Alliance",rock n roll n wrestling
Los Bitchos Return With Glittery Disco Rocker (And Tour Dates),https://www.rollingstone.com/music/music-news/los-bitchos-new-track-la-bomba-tour-dates-1235009763/,"Inspired by Nile Rodgers and Anita Ward, the all-women global band roars back with “La Bomba”",Disco Baby
Nick and Aaron Carter are 'Fallen Idols' in New Doc Trailer,https://www.rollingstone.com/music/music-news/nick-carter-aaron-carter-docuseries-fallen-idols-1235009669/,"Investigation Discovery's next series will examine the assault allegations against Nick, and Aaron's struggles with substance abuse and mental-health issues",Carter Chaos
Victoria Monét Found a Sliver of a Silver Lining After Being 'Frustrated' With PCOS Symptoms,https://www.rollingstone.com/music/music-news/victoria-monet-polycystic-ovary-syndrome-1235009646/,"""Optimistically, at least now there's two moons on the stage,"" the singer wrote about the condition-related weight gain that impacts her ""face, arms, tummy and most effectively … datassss""",Two Moons
Anita Pallenberg Doc: Scarlett Johansson Narrates Vacation With the Rolling Stones,https://www.rollingstone.com/music/music-news/anita-pallenberg-rolling-stones-scarlett-johansson-catching-fire-documentary-1235009525/,"Catching Fire: The Story of Anita Pallenberg, out next month, tells the story of the model, actress, and mother of Keith Richards' children",Exclusive
Billie Eilish Opens Up About Her Mental Health: 'I'm a Depressed Person',https://www.rollingstone.com/music/music-news/billie-eilish-mental-health-depressed-person-1235009279/,"The pop star tellsRolling Stonehow she emerged from the throes of deep depression last summer that was ""realer than it’s ever been before""",Ok Not to Be Ok
Rico Wade: Funeral Plans Revealed for Organized Noize Producer,https://www.rollingstone.com/music/music-news/rico-wade-funeral-plans-revealed-1235009645/,Member of pioneering production trio to be laid to rest in private service at Atlanta church Friday,R.I.P.
"David Gilmour to Release New Album, 'Luck and Strange,' This Fall",https://www.rollingstone.com/music/music-news/david-gilmour-luck-and-strange-solo-album-1235009520/,"Former Pink Floyd frontman will release a new single, ""The Piper's Call,"" on Thursday",Lucky Indeed
Billie Eilish Says 'Self-Pleasure' Helps Her Feel 'Empowered and Comfortable' in Her Body,https://www.rollingstone.com/music/music-news/billie-eilish-sex-self-pleasure-1235009503/,"""People should be jerking it, man,"" the pop star tellsRolling Stone. ""I can’t stress it enough, as somebody with extreme body issues and dysmorphia that I’ve had my entire life""",Love Yourself
The VMAs Will Celebrate Its 40th Anniversary in New York,https://www.rollingstone.com/music/music-news/mtv-vmas-2024-date-location-1235009582/,The show will take place Sept. 10 at the UBS Arena on Long Island,2024 MTV VMAs
Lauv Needs to Know What the Future Could Hold on New Single 'Potential',https://www.rollingstone.com/music/music-news/lauv-potential-music-video-single-release-1235009530/,"The pop singer and songwriter recently opened up about breakthroughs he has made in understanding his sexuality, a process that he depicts in the Luke Orlando-directed visual",Worth a Shot
Girl in Red Covers Talking Heads' 'Girlfriend Is Better' for Upcoming Tribute Album,https://www.rollingstone.com/music/music-news/girl-in-red-covers-talking-heads-girlfriend-is-better-1235009408/,"On the LP, Miley Cyrus covers ""Psycho Killer,"" Lorde performs ""Take Me to the River,"" and Paramore sings ""Burning Down the House""",For Byrne
Dominic Fike Shares Eight New Songs He 'Can't Live Without' in Visual Project '14 Minutes',https://www.rollingstone.com/music/music-news/dominic-fike-14-minutes-visual-1235009473/,"The songs are not yet on streaming, but the musician uploaded the video to YouTube on Tuesday following a surprise release event in West Hollywood",Letting It Out
"Maya Hawke Details Toxic Love in New Single, 'Hang in There'",https://www.rollingstone.com/music/music-news/maya-hawke-hang-in-there-single-1235009442/,"The song follows the release of ""Dark"" and “Missing Out” from upcoming LP,Chaos Angel",Chaos Angel
Rick Ross' Drake Diss Video Is Actually Self-Promo (And It's Genius),https://www.rollingstone.com/music/music-news/rick-ross-drake-diss-video-champagne-moments-1235009397/,"Rap star dropped ""Champagne Moments"" after Drake released the Kendrick Lamar (and others) diss track ""Push Ups""",Laughing With You
St. Vincent Looks Inside to Reveal 'Big Time Nothing' on New Song,https://www.rollingstone.com/music/music-news/st-vincent-big-time-nothing-single-1235009363/,"The delirious new track is the third single fromAll Born Screaming, out Friday",Sashay
Megan Thee Stallion Sued by Personal Cameraman for Harassment and 'Hostile Work Environment',https://www.rollingstone.com/music/music-news/megan-thee-stallion-sued-cameraman-hostile-work-environment-1235009042/,"Emilio Garcia says he was ""mortified"" when Megan Thee Stallion allegedly engaged in sexual contact with a woman while next to him in a moving vehicle in Spain",Courts
Post Malone and Michael Bay Are Cooking Up Something Crazy With Demons and Trucks,https://www.rollingstone.com/music/music-news/post-malone-michael-bay-graphic-novel-movie-1235009062/,The musician and filmmaker are collaborating on a new project that'll start as a graphic novel to be published in 2025,Truck Yeah
"Pearl Jam, Sting, Alanis Morissette Lead Ohana Fest 2024",https://www.rollingstone.com/music/music-news/pearl-jam-neil-young-alanis-morissette-headline-ohana-fest-2024-1235009056/,"Maren Morris, Black Pumas, Jenny Lewis, Flipturn, and Idles are also scheduled to perform",'Dark Matter' Celebration
Twenty One Pilots Album 'Clancy' Delayed While They Film Videos for Every Single Song,https://www.rollingstone.com/music/music-news/twenty-one-pilots-album-clancy-delayed-1235008983/,"The album will now arrive on May 24, one week after its intended release date",Just a Little Longer
Pitbull Is Ready to ‘Party After Dark’ on North American Tour,https://www.rollingstone.com/music/music-news/pitbull-party-after-dark-north-american-tour-1235009019/,"The trek featuring special guest T-Pain with Lil Jon on select stops kicks off Aug. 21 in Bristow, Virginia",On the Road
"Post Malone, Tyler, the Creator, Sturgill Simpson, and Killers Lead Outside Lands 2024",https://www.rollingstone.com/music/music-news/post-malone-tyler-the-creator-sturgill-simpson-killers-lead-outside-lands-2024-1235008987/,"Chappell Roan, Tyla, Teddy Swims, Victoria Monét, Kaytranada, and Grace Jones are also featured on the festival's lineup",Ranger Dave's Ready
John Lennon's 'Help!' Guitar Headed to Auction After Spending the Last 50 Years in an Attic,https://www.rollingstone.com/music/music-news/john-lennon-lost-help-guitar-auction-1235008971/,Lennon and George Harrison played the Framus 12-string Hootenanny acoustic onHelp!andRubber Soul,Lost and Found
Tennessee Police Department 'Continuing to Investigate' Death of 'American Idol' Alum Mandisa,https://www.rollingstone.com/music/music-news/mandisa-death-being-investigated-tennessee-police-1235008927/,"""At this time, there is no indication the death was the result of suspicious or criminal activity,"" the Franklin  Police Department said",Developing
"Marshmello, PinkPantheress to Perform at 2024 MLS All-Star Concert",https://www.rollingstone.com/music/music-news/marshmello-pinkpantheress-2024-mls-all-star-concert-lineup-1235008398/,"Music show will arrive several days before the MLS All-Stars face off against the Liga MX All-Stars in Columbus, Ohio",Exclusive
"Jon Bon Jovi Is a 'Rock and Roll Star, Not a Saint' in New Trailer for Interview Special",https://www.rollingstone.com/music/music-news/jon-bon-jovi-richie-sambora-vocal-injury-abc-interview-1235008521/,"The musician will discuss Richie Sambora reunion possibilities, his vocal cord injury, and more withGood Morning Americaco-anchor Michael Strahan",Opening Up
Mitski Searches for Love Through a Haze on the Water in 'Star' Video,https://www.rollingstone.com/music/music-news/mitski-star-video-1235008588/,Track is fromThe Land Is Inhospitable and So Are Wealbum,Love Boat
"Hayley Williams Has Been Blasting Taylor Swift and Beyoncé's New Albums, Too",https://www.rollingstone.com/music/music-news/hayley-williams-praises-beyonce-taylor-swift-albums-1235008722/,"""Being around people who enjoy music in its sexiest form was like being plugged directly into the sun,"" wrote Williams, referring to Record Store Days",Queens
Céline Dion on Living With Stiff Person Syndrome: 'Nothing's Going to Stop Me',https://www.rollingstone.com/music/music-news/celine-dion-living-with-stiff-person-syndrome-1235008703/,"""At the beginning, I would ask myself: 'Why me? How did this happen? What have I done? Is this my fault?'"" she said. ""Life doesn't give you any answers""",Power of Love
Taylor Swift Reveals Meaning Behind Songs in 'The Tortured Poets Department',https://www.rollingstone.com/music/music-news/taylor-swift-tortured-poets-department-song-meanings-1235008538/,The singer offered insight into her latest record-breaking album,Fortnight
Luke Bryan Falls Onstage After Slipping on a Fan's Cellphone,https://www.rollingstone.com/music/music-news/luke-bryan-falls-slipping-fan-cellphone-onstage-1235008625/,"""My lawyer will be calling!"" joked the country singer",A Big Fall
"Scott Weiland's Son Brushes Off Blackmail Threat, Releases New Song With Late Dad's Vocals",https://www.rollingstone.com/music/music-news/scott-weiland-son-noah-song-time-will-tell-blackmail-threat-1235008456/,"Noah Weiland decided to release ""Time Will Tell"" after someone said they'd leak an older version of the song unless Noah forked over $2,000",Extortion Fail
"Childish Gambino Teases Songs With Kanye, Kid Cudi as He Promises World Tour",https://www.rollingstone.com/music/music-news/childish-gambino-teases-kanye-kid-cudi-songs-world-tour-1235008424/,The musician announced that he was working on two new albums last weekend,Bino's Back
"Imagine Dragons Plan Summer Tour for New Album, 'Loom'",https://www.rollingstone.com/music/music-news/imagine-dragons-tour-loom-album-1235008392/,"The nine-track album, made with their ""Believer"" collaborators, will come out June 28",On the Road Again
Madonna Sued Again for Late Concerts: 'A Consumer's Worst Nightmare',https://www.rollingstone.com/music/music-news/madonna-live-nation-lawsuit-1235008326/,Plaintiffs also allege singer kept concert uncomfortably hot on purpose and that she lip-synced,Courts and Crime
'Let's Live On': BTS Share Anti-Bullying 'Love Myself' Campaign Video,https://www.rollingstone.com/music/music-news/bts-love-myself-anti-bullying-campaign-unicef-1235008275/,"Since the start of the campaign with UNICEF, the superstars have raised more than $6.6. billion",Boy With Luv
Vinyl in the Sun: Inside the First Solar-Powered Record Pressing Plant in the U.S.,https://www.rollingstone.com/music/music-news/audiodrome-record-pressing-solar-powered-vinyl-1235008286/,"Audiodrome Record Pressing, a new boutique shop in Gainsville, Florida, wants to make the vinyl manufacturing process as eco-friendly as possible",🌞🌞🌞
Thom Yorke Warns You to Run Away in Pensive New 'Confidenza' Soundtrack Song,https://www.rollingstone.com/music/music-news/thom-yorke-confidenza-soundtrack-knife-edge-prize-giving-1235008267/,Radiohead and Smile frontman wrote score for upcoming film,'Life or Death'
Kid Cudi Breaks Foot After Jumping Off Coachella Stage: 'Just Leaving the Hospital',https://www.rollingstone.com/music/music-news/kid-cudi-breaks-foot-coachella-2024-injured-1235008197/,"Fan footage captured the musician landing roughly on one of his feet. ""Never broken a bone before so this is all a bit crazy,"" Cudi said",Coachella 2024
"Cher, Ozzy Osbourne, Dave Matthews Band, Mary J. Blige Lead Rock and Roll Hall of Fame 2024 Class",https://www.rollingstone.com/music/music-news/rock-hall-fame-2024-cher-ozzy-osbourne-dave-matthews-band-mary-j-blige-1235007784/,"Foreigner, Peter Frampton, Kool & the Gang, A Tribe Called Quest, Jimmy Buffett, MC5, Dionne Warwick, and Big Mama Thornton will also enter the Cleveland institution",The Votes Are In
Kanye West Jumps Into the Drake V. Everybody Rap Feud With 'Like That' Remix,https://www.rollingstone.com/music/music-news/kanye-west-drake-beef-like-that-remix-1235008129/,Rapper appeared on Justin Laboy's radio show and premiered his remix to the diss track heard around the rap world,A New Challenger
"Tyler, the Creator Brings Out Earl Sweatshirt to Perform at Coachella",https://www.rollingstone.com/music/music-news/tyler-the-creator-earl-sweatshirt-performance-coachella-2024-1235008145/,The rapper teams with his former Odd Future group mate for the fest’s Weekend Two,Coachella 2024
"Spice Girls Reunion Fans (Really, Really) Want Finally Happened",https://www.rollingstone.com/music/music-news/spice-girls-reunion-performance-stop-1235008120/,The group performed together to mark Victoria Beckham’s 50th birthday on Saturday night,thank you very much
"Kevin Abstract, Lil Nas X Premiere New Song ‘Tennessee’ at Coachella",https://www.rollingstone.com/music/music-news/kevin-abstract-lil-nas-x-coachella-new-song-tennessee-1235008048/,Lil Nas X was a surprise guest during the former Brockhampton founding member's set on Weekend Two of the festival,Coachella 2024
"Drake Drops New Kendrick Lamar Diss Track With AI Tupac, Snoop Dogg Verses",https://www.rollingstone.com/music/music-news/drake-kendrick-lamar-diss-taylor-made-freestyle-ai-tupac-snoop-dogg-1235007986/,“Taylor Made Freestyle” arrives on the heels of the rapper officially releasing “Push Ups”,Beef Goes On
Camila Cabello Joins Lana Del Rey During Weekend Two of Coachella,https://www.rollingstone.com/music/music-news/camila-cabello-joins-lana-del-rey-coachella-2024-weekend-two-1235006885/,Del Rey welcomed Cabello for a surprise performance of “I Luv It”,LANACHELLA
Taylor Swift Invites Fans to Play 'Fortnight Challenge',https://www.rollingstone.com/music/music-news/taylor-swift-fortnight-challenge-2-1235007951/,The YouTube Shorts game was revealed on Friday as the video for her collaboration with Post Malone released,#ForAFortnightChallenge
"Taylor Swift, Post Malone Go Mad in Stunning 'Fortnight' Video With Ethan Hawke Cameo",https://www.rollingstone.com/music/music-news/taylor-swift-post-malone-fortnight-video-1235007623/,The stunningly dystopic tale tells the story of star-crossed lovers set in a dystopian romance,Endless February
Taylor Swift's 'Tortured Poets Department' Is Spotify's Most Streamed Album in a Single Day,https://www.rollingstone.com/music/music-news/taylor-swift-tortured-poets-department-spotify-streaming-record-1235007900/,"The album garnered more than 200 million streams in less than 24 hours, the streaming service confirmed",TTPD
Frank Zappa's Five-Hour 'Dress Optional' 1968 Concert at the Whisky Will Finally Come Out,https://www.rollingstone.com/music/music-news/frank-zappa-mothers-invention-whisky-a-go-go-1968-1235007734/,"New box set,Whisky a Go Go, 1968, collects live recording sessions by the Mothers of Invention during one of their busiest years",Freak Out
Clara Bow's Family Calls Taylor Swift Song a 'Testament' to Actress' 'Legacy',https://www.rollingstone.com/music/music-news/clara-bow-family-says-taylor-swift-song-testament-to-actress-legacy-1235007641/,"""I hope this inspires the younger generation to learn about Clara’s story and feel inspired by her perseverance,"" said the late actress' great-granddaughter, Brittany Grace Bell",Back to the Twenties
Pink Files Legal Action Against Pharrell Williams Over Musician's Proposed P.Inc. Trademark,https://www.rollingstone.com/music/music-news/pink-pharrell-williams-trademark-1235007602/,"Victoria's Secret, which runs a Pink line, also isn't happy about it",Think Pink
Taylor Swift Producers Jack Antonoff and Aaron Dessner Celebrate 'Tortured Poets' Release,https://www.rollingstone.com/music/music-news/taylor-swift-producers-jack-antonoff-aaron-dessner-celebrate-tortured-poets-1235007573/,"""I feel so grateful to be a part of creating this vast, magically detailed and symbolic world of songs Taylor has crafted that we all get to inhabit and enjoy,"" Dessner wrote",Celebrated Poets
Swifties Are Not Happy That Taylor's Matty Healy Situationship Gets So Much Attention on 'TTPD',https://www.rollingstone.com/music/music-news/taylor-swift-matty-healy-tortured-poets-department-fans-react-1235007440/,Swift's brief relationship with the 1975 frontman was never publicly confirmed by either of them but takes up significant real estate acrossThe Tortured Poets Department,"Girl, Stand Up"
"Mandisa, Contemporary Christian Star and 'American Idol' Contestant, Dead at 47",https://www.rollingstone.com/music/music-news/mandisa-american-idol-christian-music-dead-obtiuary-1235007505/,"The singer sparred with Simon Cowell and later won a Grammy for her 2013 hit album,Overcomer",Obituary
Perrie Reminisces About a Past Love in 'Forget About Us' Video,https://www.rollingstone.com/music/music-news/perrie-drops-forget-about-us-video-1235007463/,"“I look back on past relationships and do think happily about those times,” Perrie said",Shout Out to My Ex
Fans Think Taylor Swift's 'thanK you aIMee' Is About Kim Kardashian,https://www.rollingstone.com/music/music-news/taylor-swift-thank-you-aime-kim-kardashian-fan-theories-1235007386/,"And honestly, Swift isn't doing much to suggest it's not",🐍🐍🐍
See Elton John Play 'The Bitch Is Back' — as a Hornet — for the First Time in 1974,https://www.rollingstone.com/music/music-news/eltons-john-bitch-is-back-1974-1235007368/,"Artist gave song its buzzy debut ahead of the release ofCaribou, which will come out as a deluxe double LP for Record Store Day on Saturday",Raising Cain
Nas and DJ Premier Preview Long-Awaited Collaborative Album With 'Define My Name',https://www.rollingstone.com/music/music-news/nas-dj-premier-define-my-name-collaborative-album-1235007371/,"The album will arrive later this year to commemorate the 30th Anniversary of Nas' 1994 debut album,Illmatic, on which DJ Premier produced three songs",It's Album Time
Veeze Channels Detroit With StockX Sneaker Collection,https://www.rollingstone.com/music/music-news/veeze-detroit-stockx-sneaker-collection-1235003018/,The Detroit rapper talks hometown style and pride in StockX's new 'This is Love' campaign,
"Nicki Minaj, Travis Scott, Sexxy Red, and Chris Brown Bring the Sleaze for 'FTCU' Remix",https://www.rollingstone.com/music/music-news/nicki-minaj-travis-scott-sexxy-red-chris-brown-ftcu-remix-1235007343/,"The so-called ""Sleeze Mix"" for thePink Friday 2hit absolutely lives up to its name",Unabashed
Kings of Leon Share One-Take Music Video for Single 'Nothing To Do',https://www.rollingstone.com/music/music-news/kings-of-leon-nothing-to-do-music-video-1235007259/,"The song comes off the rock band's forthcoming album,Can We Please Have Fun",New Music
Taylor Swift Unveils Double Album ‘The Tortured Poets Department: The Anthology’,https://www.rollingstone.com/music/music-news/taylor-swift-the-tortured-poets-department-the-anthology-announcement-1235007251/,The singer shared 15 additional songs because she had ”written so much tortured poetry”,Bonus Tracks
Sia Taps Paris Hilton for Self-Reflexive Single 'Fame Won't Love You',https://www.rollingstone.com/music/music-news/sia-paris-hilton-fame-wont-love-you-single-1235007246/,"The song will appear on Sia's forthcoming album,Reasonable Woman",Cool Collab
James Arthur Enlists Kelly Clarkson for a Soulful Duet of 'From the Jump',https://www.rollingstone.com/music/music-news/james-arthur-kelly-clarkson-duet-from-the-jump-1235006897/,"""The melody is beautiful, and the writing is so great that I was very excited to sing on it with him!” Clarkson said",Full Circle Moment
Taylor Swift’s New Album Opens With a Stevie Nicks Poem,https://www.rollingstone.com/music/music-news/taylor-swift-the-tortured-poets-department-stevie-nicks-poem-1235007094/,But you can only find it on physical versions ofThe Tortured Poets Department,Swift ❤️ Nicks
Taylor Swift Just Released 'The Tortured Poets Department',https://www.rollingstone.com/music/music-news/taylor-swift-the-tortured-poets-department-released-1235006646/,The new album explores her most recent relationships and includes collaborations with Post Malone and Florence and the Machine,finally here
"Taylor Swift Drops Dystopic, Post Malone-Featuring Trailer for 'Fortnight'",https://www.rollingstone.com/music/music-news/taylor-swift-fortnight-trailer-post-malone-1235007158/,"""At this hearing, I stand before my fellow members of The Tortured Poets Department with a summary of my findings,"" she wrote",TTPD IS HERE
"Sky Rompiendo, Rauw Alejandro Drop Electric Collab ‘Espectacular’",https://www.rollingstone.com/music/music-news/sky-rompiendo-rauw-alejandro-espectacular-1235006870/,"Track marks the last release before Rauw's long-teased ""new era"" next month",⚡️⚡️⚡️
