title,link,summary,category
Kim Porter’s Dad Breaks Silence After Sean Combs Attack Video: 'Despicable',https://www.rollingstone.com/music/music-news/kim-porter-dad-sean-combs-cassie-attack-video-1235035716/,"""I was disgusted with the video, and I wouldn’t treat my enemy like that,"" says Jake Porter","""Disgusted"""
‘Surviving R. Kelly’ Executive Producer ‘Begged’ Diddy to Confess to Alleged Assaults on Cassie,https://www.rollingstone.com/music/music-news/surviving-r-kelly-dream-hampton-diddy-confess-cassie-assaults-1235035756/,"Filmmaker dream hampton says she told the mogul, “What we need is one of y’all motherfuckers to just say, ‘I did this,’” in a phone call and voice note last November",Exclusive
Hear Robert Plant and Alison Krauss' New Rendition of 'When the Levee Breaks',https://www.rollingstone.com/music/music-news/robert-plant-alison-krauss-when-the-levee-breaks-1235035711/,Duo share take on Led Zeppelin IV classic to mark start of longtime collaborators' summer tour,it keeps on rainin'
Bun B Describes Wife's Trauma Following Home Invasion: 'She Didn't Deserve This',https://www.rollingstone.com/music/music-news/bun-b-recalls-wifes-trauma-following-home-invasion-1235035613/,"""I just get so angry all again because she didn't deserve this, she didn't ask for this,"" the rapper said during his testimony on Thursday",Courts and Crime
"MisterWives Rock Out With Charlotte Sands on 'Other Side,' Announces 20-Date Tour",https://www.rollingstone.com/music/music-news/misterwives-drops-charlotte-sands-other-side-announces-tour-1235033300/,"MisterWives’ album Nosebleeds is getting a second life! On Friday, the band released a reimagined, rockier version of the album’s track “Other Side,” featuring Charlotte Sands. They also celebrate the arrival of new music by announcing their fall Just For One Night tour. Frontwoman Mandy Lee describes “Other Side” as a song about dealing with […]",Exclusive
Taylor Swift Told Lana Del Rey She Wanted Pop Stardom 'More Than Anyone' — and She Got It,https://www.rollingstone.com/music/music-news/taylor-swift-lana-del-rey-stardom-praise-1235035312/,"“She’s told me so many times that she wants it more than anyone. And how amazing — she’s getting exactly what she wants,"" Lana Del Rey shared",Speaking Into Existence
Fantastic Cat Commit to the Bit With New Album and  Video Featuring Adam Duritz,https://www.rollingstone.com/music/music-news/fantastic-cat-so-glad-you-made-it-video-adam-duritz-1235034974/,"The band — grown men who wear cat masks — stalk the Counting Crows singer in the video for ""So Glad You Made It""",Counting Cats
Black Keys' Dan Auerbach Featured on New Johnny Cash Song 'Spotlight',https://www.rollingstone.com/music/music-news/black-keys-dan-auerbach-featured-on-johnny-cash-song-spotlight-1235035303/,Cash's posthumous albumSongwriteris set to release on June 28,Cashback
Gracie Abrams Finally Releases Viral Single 'Close to You' Seven Years After Recording Demo,https://www.rollingstone.com/music/music-news/gracie-abrams-close-to-you-single-1235035146/,"The song will appear on the singer and songwriter's upcoming studio albumThe Secret of Us, out June 21",Close and Getting Closer
"BIA Talks Fashion, Artistic Optimism, and Working With JID in 'Lights Out' Behind the Scenes Video",https://www.rollingstone.com/music/music-news/bia-lights-out-behind-the-scenes-lights-out-video-1235034965/,"The rapper welcomesRolling Stoneonto the set for her latest single as she's hooked up to floating wires, decked out in layers of jewelry, and pushed outside of her fashion comfort zone",Behind The Scenes
The Boy Is Indeed Penn Badgley in Ariana Grande's Cat-Filled 'The Boy Is Mine' Video,https://www.rollingstone.com/music/music-news/ariana-grande-penn-badgley-monica-brandy-boy-is-mine-video-1235035153/,Brandy and Monica also cameo in the eagerly-anticipatedEternal Sunshineclip,The Boy Is Meow
Glass Animals Are Trapped In an Airlock on New Single and Video,https://www.rollingstone.com/music/music-news/glass-animals-new-song-video-tear-in-space-1235034728/,"""Tear in Space (Airlock)"" is the second single from upcoming albumI Love You So F***ing Much",out of this world
'Trap': M. Night Shyamalan's Daughter Saleka (as Lady Raven) Shares First Song From Dad's New Film,https://www.rollingstone.com/music/music-news/trap-m-night-shyamalan-daughter-saleka-lady-raven-new-song-release-1235033617/,R&B singer also portrays a pop star in the upcoming cat-and-mouse serial killer movie that takes place at a concert,release
Celine Dion Says Singing With Stiff-Person Syndrome Feels 'Like Somebody Is Strangling You',https://www.rollingstone.com/music/music-news/celine-dion-describes-singing-stiff-person-syndrome-1235035029/,The singer also discussed a spasm that broke one of her ribs in a preview of her upcoming primetime interview with Hoda Kotb,Harrowing
See Eminem Debut 'Houdini' and Perform With Jelly Roll at Detroit's Michigan Central Concert,https://www.rollingstone.com/music/music-news/eminem-houdini-jelly-roll-detroit-michigan-central-concert-1235034979/,"Jack White, Diana Ross, Big Sean, and more also delivered mini-sets at all-star show celebrating reopening of Motor City landmark",welcome 2 detroit
"Post Malone, Blake Shelton Serve Up Two Surprise Performances of Unreleased Song 'Pour Me a Drink'",https://www.rollingstone.com/music/music-news/post-malone-blake-shelton-perform-unreleased-song-pour-me-a-drink-1235034944/,"On the first night of CMA Fest in Nashville, the pair delivered a full-band version at Nissan Stadium before going unplugged at Spotify House at Shelton's bar",🍻
"Latto Taps Megan Thee Stallion, Flo Milli for 'Sunday Service' Remix",https://www.rollingstone.com/music/music-news/latto-megan-thee-stallion-flo-milli-sunday-service-remix-1235034929/,The rapper dropped the original version back in February,Girl Power
The Black Keys Split With Management Team After Arena Tour Cancellation,https://www.rollingstone.com/music/music-news/the-black-keys-management-split-arena-tour-cancellation-1235034923/,The rock band abruptly pulled the plug on its fall North American tour last month amid reports of low ticket sales,Bye Bye Bye
"Hear Orville Peck, Kylie Minogue Team Up for Rousing Single 'Midnight Ride'",https://www.rollingstone.com/music/music-news/orville-peck-kylie-minogue-midnight-ride-single-1235034917/,The duo debuted the song Outloud Fest earlier this month,Cool Collab
BTS' Jung Kook Celebrates Fans on Heartfelt Single 'Never Let Go',https://www.rollingstone.com/music/music-news/bts-jung-kook-never-let-go-single-1235034912/,"The solo single is his first new music since last year's LP,Golden",Holding On
"Ariana Grande Declares ‘The Boy Is Mine' on 'Fallon,' Confirms Penn Badgley Will Star in Video",https://www.rollingstone.com/music/music-news/ariana-grande-the-boy-is-mine-fallon-penn-badgley-video-1235034881/,The artist performed theEternal Sunshinesong and talked about having to keep herWickedrole a secret,Stars Aligned
Bon Jovi and Jason Isbell Ride the 'Waves' on New Song,https://www.rollingstone.com/music/music-news/bon-jovi-jason-isbell-new-song-waves-1235034462/,"Track appears on the Jersey rockers' new album,Forever",Catch a Wave
Watch Kelly Clarkson Jumble Bon Jovi's 'Blaze of Glory' Lyrics in Blooper Reel,https://www.rollingstone.com/music/music-news/kelly-clarkson-bon-jovi-blaze-of-glory-1235034732/,"""That is the song that almost killed me, not even because I can't sing it, I just can't read,"" Clarkson said",Nobody's Perfect
"Sabrina Carpenter Falls For, Handcuffs Barry Keoghan in 'Please Please Please' Video",https://www.rollingstone.com/music/music-news/sabrina-carpenter-please-please-please-barry-keoghan-1235033630/,"The song, which follows up the sugary hit ""Espresso,"" will appear on the singer's upcoming album,Short n' Sweet, out Aug. 23",Pretty Please
Lil Yachty and James Blake to Release 'Bad Cameo' This Month,https://www.rollingstone.com/music/music-news/lil-yachty-james-blake-bad-cameo-1235034413/,Collaborators have described album as unlike anything either of them has made before,"'Bad Cameo,' Good News"
Blackpink's Lisa Teases New Solo Music,https://www.rollingstone.com/music/music-news/blackpink-lisa-new-solo-music-1235034482/,"The artist's Instagram and TikTok both say ""coming soon,"" and there are new pre-save links on streaming services",By Herself
Lorde Praises Charli XCX's New Album Amid 'Brat' Track Beef Speculation,https://www.rollingstone.com/music/music-news/lorde-charli-xcx-brat-girl-so-confusing-1235034454/,"""There is NO ONE like this bitch,"" Lorde wrote on her Instagram Story",No Drama
See Trailer for New Documentary Focused on E Street Band's Steven Van Zandt,https://www.rollingstone.com/music/music-news/steven-van-zandt-disciple-documentary-hbo-1235034433/,"Disciple— featuring interviews with Paul McCartney, Eddie Vedder, Bill Wyman, Bono and, of course, Bruce Springsteen — premieres at Tribeca Film Festival before heading to HBO in June",'rock n' roll brother'
Omar Apollo Announces He'll Launch 'God Said No' Tour This Fall,https://www.rollingstone.com/music/music-news/omar-apollo-god-said-no-tour-dates-1235034164/,"The R&B artist is also getting ready to release his upcoming album, which he's said contains his best music yet",apollo alert
"MC5 to Release New Album 'Heavy Lifting,' First LP in 53 Years",https://www.rollingstone.com/music/music-news/mc5-new-album-heavy-lifting-1235034356/,"All-star album - featuring guests like Tom Morello, Slash, Vernon Reid, and more - arrives just months after deaths of proto-punk legends Wayne Kramer and Dennis Thompson",kick out the jams
"Billie Eilish Directed a Dreamy, Surrealistic Video for 'Chihiro'",https://www.rollingstone.com/music/music-news/billie-eilish-chihiro-video-1235034281/,Track comes off her recentHit Me Hard and Softalbum,Spirited Away
Metallica Set Second Annual Marching Band Competition,https://www.rollingstone.com/music/music-news/metallica-marching-band-competition-1235034218/,Thrashers will give more than a quarter of a million dollars worth of gear to winning bands,Metal for Metal
Hear David Byrne and Devo's Long-Unheard Collaboration 'Empire',https://www.rollingstone.com/music/music-news/david-byrne-devo-empire-noise-for-now-1235033830/,Track from singer's sessions for 1997 LP Feelings unearthed forNoise for Now Vol. 2comp benefitting abortion access,voices like thunder
Soccer Mommy Grieves on New Song 'Lost',https://www.rollingstone.com/music/music-news/soccer-mommy-lost-1235034139/,Tune is artist's first single since 2022'sSometimes Forever,'Something New'
"Sam Smith to Interview Elliot Page, Ben Platt, More on New 'Pink House' Podcast",https://www.rollingstone.com/music/music-news/sam-smith-pink-house-podcast-elliot-page-ben-platt-1235033790/,"Smith's new show will create ""a healing safe space for queer people and a roadmap for queer allies""",Exclusive
Jelly Roll Struggling to Book International Tour Dates Due to Felony Convictions,https://www.rollingstone.com/music/music-news/jelly-roll-international-tour-challenges-felony-convictions-1235034065/,"""We’re figuring out the final pieces of some legal puzzles for me to get overseas""",Working On It
Kendrick Lamar Announces Los Angeles 'Ken and Friends' Concert for Juneteenth,https://www.rollingstone.com/music/music-news/kendrick-lamar-ken-and-friends-concert-los-angeles-juneteenth-1235034060/,The show marks the rapper's first live performance since Drake beef,Victory Lap
Watch Shaboozey's Rousing Performance of 'A Bar Song (Tipsy)' on 'Fallon',https://www.rollingstone.com/music/music-news/shaboozey-a-bar-song-tipsy-performance-fallon-1235034055/,"The single appears on the musician's new LP,Where I’ve Been, Isn’t Where I’m Going",One More Shot
"Travis Scott Moves to Dismiss Sample Lawsuit Over ‘Alright, Alright, Alright’ Lyrics",https://www.rollingstone.com/music/music-news/travis-scott-alright-alright-alright-sample-copyright-lawsuit-1235033863/,"The rapper's lawyers argue that the phrase — allegedly taken from DJ Jimi's 1992 song ""Bitches (Reply)"" — is too common to warrant copyright protection",Copyright Claims
Gloria Trevi Sex Abuse Lawsuits: Search for Music Producer Sergio Andrade Intensifies,https://www.rollingstone.com/music/music-news/gloria-trevi-sex-abuse-lawsuits-sergio-andrade-mexico-1235033715/,"""[Andrade] mysteriously appeared in some medical facility in Madrid and then seemingly disappeared,"" a California judge said Wednesday",'Seemingly Disappeared'
"Halsey Details 'Rocky Start' in Recovery From Lupus, Rare T-Cell Disorder",https://www.rollingstone.com/music/music-news/halsey-health-update-medical-diagnosis-1235033789/,"""After 2 years, I’m feeling better and I’m more grateful than ever to have music to turn to,"" said the artist",Hopeful and Healing
"Neko Case to Release Memoir, Which Will 'Cast a Spell of Love,' Next Year",https://www.rollingstone.com/music/music-news/neko-case-the-harder-i-fight-the-more-i-love-you-book-1235033779/,"The Harder I Fight, the More I Love Youwill look at her humble beginnings through critical claim",A Case of Her
Adam Levine Returning to 'The Voice' on Season 27 Coaching Panel Alongside Kelsea Ballerini,https://www.rollingstone.com/music/music-news/the-voice-season-27-coaching-panel-1235033557/,The pair will work alongside returning coaches Michael Bublé — who will make his debut on season 26 later this year — and John Legend,Planning for the Future
See Soccer Mommy Bring Out Phoebe Bridgers for Elliott Smith Cover at L.A. Show,https://www.rollingstone.com/music/music-news/soccer-mommy-phoebe-bridgers-elliott-smith-cover-1235033713/,"In addition to rendition of ""The Biggest Lie,"" Sophie Allison also debuts a handful of new songs at latest gig",Under Cover
"See Ethel Cain Cover 'Bette Davis Eyes,' Debut Unreleased Songs in Paris",https://www.rollingstone.com/music/music-news/ethel-cain-bette-davis-eyes-1235033588/,"Artist is mixing up set lists as she promotes her debut album,Preacher's Daughter",Standoff Sighs
"The Jesus Lizard Announce First New Album in 26 Years, 'Rack'",https://www.rollingstone.com/music/music-news/the-jesus-lizard-new-album-rack-1235033505/,"Noise-rock legends share first single ""Hide & Seek"" from their first LP together since 1998'sBlue",BACK
How the Yeah Yeah Yeahs' 'Maps' Became One of Rock's Most Iconic Love Songs,https://www.rollingstone.com/music/music-news/the-yeah-yeah-yeahs-maps-podcast-greatest-songs-1235031913/,"The newest episode of Rolling Stone's500 Greatest Songspodcast dives into the legacy of the Yeah Yeah Yeahs, Karen O, and the band's most enduring hit",500 Greatest Songs
Lorde Teases Her Creative Path Forward With Cryptic Messaging and Hieroglyphics in Social Media Return,https://www.rollingstone.com/music/music-news/lorde-fourth-album-social-media-return-1235033457/,"""Use the existing tools wherever possible ©𝑳ĿŁု⑷♶,"" Lorde wrote in the caption of her post. ""If the tools do not exist you are spiritually obliged to create them © 𝑳ĿŁု⑷♶⚤✬✹❁✰㉗✬✹❁🀥⚭𓆝𓃹𓁙""",Spit It Out
David Lynch Directed Something New — A Music Video for His Next Album With Chrystabell,https://www.rollingstone.com/music/music-news/david-lynch-chrystabell-new-album-cellophane-memories-1235033484/,"Cellophane Memoriesarrives in August, but you can hear the first single, ""Sublime Eternal Love"" (and watch the music video) now",Seeking the Sublime
Anohni and the Johnsons Set First North American Tour Dates in Years,https://www.rollingstone.com/music/music-news/anohni-johnsons-tour-1235033470/,Gigs arrive on the release of last year's critically acclaimedMy Back Was a Bridge for You to Cross,Finally
"Illuminati Hotties Announce New Album ‘Power,’ Share Lead Single 'Didn't'",https://www.rollingstone.com/music/music-news/illuminati-hotties-announce-new-album-power-1235033365/,Their fourth full-length release is out in August,album announcement
Ice Spice Sets Summer Release Date for Debut Album ‘Y2K’ and Unveils Headlining Tour Dates,https://www.rollingstone.com/music/music-news/ice-spice-y2k-release-date-1235033354/,The record will arrive on July 26 with a North American tour launching July 30,Countdown Begins
"Bruce Springsteen, Billie Joe Armstrong, Bleachers Cover Jesse Malin Songs for New Tribute Album",https://www.rollingstone.com/music/music-news/bleachers-cover-jesse-malin-tribute-album-1235032633/,"Jack Antonoff and his band deliver ""Prisoners of Paradise,"" the first release fromSilver Patron Saints: The Songs of Jesse Malin, a record benefitting the New York icon as recovers from a spinal stroke",Benefit Album
Kane Brown and Jelly Roll Have a 'Powerful' New Song About Mental Health on the Way,https://www.rollingstone.com/music/music-news/kane-brown-jelly-roll-tease-new-song-depression-1235033336/,"""It's talking about depression and, you know, you could have everything in the world, but as long as you don't talk to someone about it, you're still gonna go through those things,"" Kane Brown shared",Better Together
Hear GloRilla Remix 'Wanna Be' With Megan Thee Stallion and Cardi B,https://www.rollingstone.com/music/music-news/glorilla-megan-thee-stallion-cardi-b-wanna-be-remix-1235033318/,"The rapper initially released the track on her recent LP,Ehhthang Ehhthang",Cool Collab
"Lady Gaga References Taylor Swift, Encourages Fans to Vote While Shutting Down Pregnancy Rumor",https://www.rollingstone.com/music/music-news/lady-gaga-taylor-swift-lyric-vote-election-1235033141/,"""Not pregnant,"" she wrote. ""Just down bad cryin' at the gym""",Tortured Poet?
"Kanye West Accuses Former Assistant of 'Sexual Coercion,' Blackmail After Harassment Lawsuit",https://www.rollingstone.com/music/music-news/kanye-west-assistant-sexual-harassment-lawsuit-response-1235033146/,"The rapper's legal rep claimed Lauren Pisciotta's sexual harassment accusations were ""baseless"" and said West planned to countersue",In Response
"Mandisa, Beloved 'American Idol' Alum, Cause of Death Revealed",https://www.rollingstone.com/music/music-news/mandisa-christian-star-american-idol-cause-of-death-1235033097/,The Grammy-winning Christian star died at the age of 47 in April,CAUSE OF DEATH
Keanu Reeves to Tour With Band Dogstar This Summer,https://www.rollingstone.com/music/music-news/keanu-reeves-dogstar-tour-1235032987/,Dates kick off in Indianapolis in August,Dog Run
Simon Cowell Is Looking for the Next One Direction,https://www.rollingstone.com/music/music-news/simon-cowell-boy-band-auditions-one-direction-1235032879/,The industry veteran will host open call auditions across the UK next month and might be capturing his search in an upcoming documentary series,Let's Try This Again
"Sean Combs Sells Stake in Revolt, the Media Company He Co-Founded",https://www.rollingstone.com/music/music-news/sean-combs-sells-stake-in-revolt-media-company-co-founded-1235032802/,"""We have completely separated and dissociated from each other,"" said Revolt's CEO of Diddy",Not an Owner
"Hit Songwriter The-Dream Sued for Rape, Physical Abuse",https://www.rollingstone.com/music/music-news/the-dream-lawsuit-rape-sexual-abuse-1235032723/,"Grammy winner accused of ""abusive, violent, and manipulative relationship filled with physical assaults, violent sexual encounters, and horrific psychological manipulation""",Courts and Crime
Los Bitchos Dance on the Sand in Video for Beach Rocker 'Don't Change',https://www.rollingstone.com/music/music-news/los-bitchos-dont-change-video-talkie-talkie-1235032730/,"Track hails from their upcomingTalkie Talkiealbum, out in August",Los Beachos
Halsey Launches Fifth Album Era With Chilling New Single 'The End' About Being 'Lucky to Be Alive',https://www.rollingstone.com/music/music-news/halsey-the-end-single-health-struggles-1235031957/,"Halsey battles existentialism and health struggles on the record, which she released with a note reading: “Long story short, I'm lucky to be alive. Short story short, I wrote an album. It beings with The End""",Where I've Been
Drake Brings 'Hey There Delilah' to Toronto on Comical 'Wah Gwan Delilah' Remix,https://www.rollingstone.com/music/music-news/drake-hey-there-delilah-remix-1235032621/,The rapper delivers a verse with an exaggerated Jamaican accent on the remix track from social media personality Snowd4y,What Are We Doing
"Lisa Marie Presley's Memoir, Co-Written by Riley Keough, Out This Fall",https://www.rollingstone.com/music/music-news/lisa-marie-presley-memoir-riley-keough-1234944652/,"Actress will also read audiobook ofFrom Here to the Great Unknown, featuring mother's own voice via ""breathtaking vulnerable"" recordings",turn the page
Demi Lovato on Rediscovering 'Hope' After Five In-Patient Mental Health Treatments,https://www.rollingstone.com/music/music-news/demi-lovato-center-for-youth-mental-health-annual-benefit-speech-1235032576/,The singer spoke at the Center For Youth Mental Health’s annual benefit,One Day at a Time
"iHeartRadio Music Festival Taps Doja Cat, Paramore, Gwen Stefani for 2024 Lineup",https://www.rollingstone.com/music/music-news/iheartradio-music-festival-2024-lineup-1235032531/,"Hozier, Big Sean, Camila Cabello, Victoria Monét, New Kids on the Block, and more will perform at the two-day event in Las Vegas on September 20 and 21",Taking the Stage
Kim Petras Reframes Meaning of 'Accept Yourself' in Touching Pride Message,https://www.rollingstone.com/music/music-news/kim-petras-accept-yourself-pride-message-1235032450/,"The term was ""something doctors and psychologists would frequently tell me when I went to see them at 8, at 10, at 12, and at 16,"" wrote the singer",For the Dolls
"Brother Marquis, Pioneering 2 Live Crew Rapper, Dead at 58",https://www.rollingstone.com/music/music-news/brother-marquis-2-live-crew-dead-obituary-1235032338/,The Miami hip-hop group drew controversy in the Eighties and Nineties for their expletive-filled tracks,Obituary
"Sean Kingston Booked Into Florida Jail, Held on $100,000 Bond",https://www.rollingstone.com/music/music-news/sean-kingston-booked-jail-florida-fraud-charges-1235032400/,"Kingston is facing 10 charges, including nine related to grand theft and fraud accusations",Behind Bars
The Boy in Ariana Grande's 'The Boy Is Mine' Video Is Hers — But Is He Also Penn Badgley?,https://www.rollingstone.com/music/music-news/ariana-grande-penn-badgley-the-boy-is-mine-video-teasers-1235031919/,The musician and actor shared a series of obscure social media posts seemingly teasing the upcoming clip for theEternal Sunshinesong,"The Stars, They Aligned"
Vince Staples Plans 'Black in America' Tour,https://www.rollingstone.com/music/music-news/vince-staples-black-in-america-2024-tour-dates-1235031931/,"Dates arrive after the release of the rapper's latest album,Dark Times",On the Road
Young Dolph Murder Trial Pushed to September,https://www.rollingstone.com/music/music-news/young-dolph-murder-trial-delayed-september-1235031888/,"The prosecution and defense both requested time to prep expert witnesses, postponing a trial that's already faced several delays",Young Dolph Trial
It Is That Sweet: Sabrina Carpenter Will Release New Album 'Short n' Sweet' in August,https://www.rollingstone.com/music/music-news/sabrina-carpenter-short-n-sweet-album-announcement-1235031805/,"""This project is quite special to me and I hope it'll be something special to you too,"" the singer wrote on social media about the album out Aug. 23, teasing a surprise coming at the end of the week",She's Working Late
Kylie Minogue and Orville Peck Blend Country and Disco With 'Midnight Ride' Debut at Outloud Fest,https://www.rollingstone.com/music/music-news/kylie-minogue-orville-peck-debut-song-outloud-fest-weho-pride-1235031215/,"Pop legend closed out an inspiring West Hollywood Pride weekend with her biggest hits, including “Padam Padam” and “Can’t Get You Out of My Head”",A Queer Celebration
"Pixies Test Your Patience With 'You're So Impatient,' 'Que Sera, Sera' Double A-Sided Single",https://www.rollingstone.com/music/music-news/pixies-youre-so-impatient-que-sera-sera-single-1235031760/,Songs come out ahead of tour with Modest Mouse this summer,"Whatever Will Be, Will Be"
PJ Harvey Pays Steve Albini Tribute at Primavera: 'He Should Have Been Here',https://www.rollingstone.com/music/music-news/pj-harvey-steve-albini-primavera-tribute-1235031524/,"Artist dedicated ""The Desperate Kingdom of Love"" to Albini and performed two songs fromRid of Me, which he recorded",Homage
Tems Debuts New Song 'Unfortunate' During NPR 'Tiny Desk' Concert,https://www.rollingstone.com/music/music-news/tems-npr-tiny-desk-concert-unfortunate-1235031374/,"The Nigerian musician also performed her recent single, “Love Me JeJe""",Live Licks
Watch Noah Kahan Perform Counting Crows Ballad 'A Long December' With Adam Duritz in Kentucky,https://www.rollingstone.com/music/music-news/noah-kahan-counting-crows-long-december-cover-1235031289/,The singer and songwriter headlined Railbird Festival and Counting Crows performed earlier in the night,Welcome to the Stage
Gracie Abrams Plots 2024 'The Secret of Us' Headlining Tour,https://www.rollingstone.com/music/music-news/gracie-abrams-2024-tour-dates-the-secret-of-us-album-1235031279/,"The 18-date trek will go coast-to-coast this September and October, from Portland, Oregon to Portland, Maine",Keep It Like a Secret
Bebe Rexha Warns Crowd About Consequences of Throwing Items: 'I Pressed Charges to the Other Guy',https://www.rollingstone.com/music/music-news/bebe-rexha-removes-audience-members-throwing-objects-1235031229/,The singer and songwriter had to receive stitches after being struck in the face with a cell phone during a performance in New York last year,Don't Test Me
