title,link,summary,category
Wallows Are Working Late Because They're Singers Covering Sabrina Carpenter's 'Espresso',https://www.rollingstone.com/music/music-news/wallows-sabrina-carpenter-espresso-cover-1235023326/,"The band stopped by SiriusXM's Alt Nation to perform an acoustic rendition of the pop single and selections from their upcoming albumModel,out May 24",Mountain Dew It For Ya
"John Oates on Daryl Hall Legal Fight: 'Brothers Have Disagreements, Families Grow Apart'",https://www.rollingstone.com/music/music-news/john-oates-daryl-hall-legal-fight-strained-relationship-1235023264/,"Oates defended his effort to sell his half of Whole Oates Enterprises, which Hall has tried to stop in court",No Can Do
Sean Combs Seen Kicking and Dragging Cassie on Surveillance Video,https://www.rollingstone.com/music/music-news/sean-combs-cassie-hotel-video-kicking-1235022175/,A 2016 incident seems to correspond to an alleged physical attack described by Cassie in her November lawsuit against the hip-hop mogul,"""GUT-WRENCHING"""
"BTS' RM Unveils 'Right Place, Wrong Person' Track List Featuring Little Simz",https://www.rollingstone.com/music/music-news/bts-rm-unveils-right-place-wrong-person-track-list-1235023144/,"Album will also include the single ""Come Back to Me"" and a track with Moses Sumney",Staying Put
Billie Eilish Has a Cravings-Induced Crush in 'Lunch' Video,https://www.rollingstone.com/music/music-news/billie-eilish-lunch-music-video-1235023091/,"The song appears on the singer's third studio album,Hit Me Hard and Soft, out today",Hot and Hungry
"Lupe Fiasco Announces Ninth Album 'Samurai,' His 'Most Personal Album to Date'",https://www.rollingstone.com/music/music-news/lupe-fiasco-announces-album-samurai-drops-single-1235023097/,"Fiasco also released the LP's first single and title track: “The word ‘samurai’ means to serve,” he said",Ready to Serve
Demi Lovato Dives Deeper Into Rock With Slash on Temptations' 'Papa Was a Rolling Stone' Cover,https://www.rollingstone.com/music/music-news/slash-demi-lovato-papa-was-a-rolling-stone-1235022877/,"Song comes off Guns N' Roses' guitarist's just-released solo album,Orgy of the Damned",Not Sorry
Neil Young and Crazy Horse Are Unearthing Their 'Early Daze' on New Archival LP,https://www.rollingstone.com/music/music-news/neil-young-crazy-horse-early-daze-archival-lp-1235023024/,"The album chronicles the group's first recordings and features a previously unheard version of ""Helpless""",Young Neil
Taylor Swift Expands 'Tortured Poets Department' (Again) With Limited Edition First Draft Phone Memos,https://www.rollingstone.com/music/music-news/taylor-swift-tortured-poets-department-phone-memos-1235022927/,"The new versions of ""The Black Dog,"" ""Cassandra,"" and ""Who’s Afraid Of Little Old Me?"" were initially only available for purchase for six hours, but the singer has extended the sale for another few hours",Clock Is Ticking
Remi Wolf Has 'Big Ideas' for Her 2024 Headlining Tour,https://www.rollingstone.com/music/music-news/remi-wolf-2024-tour-dates-big-ideas-1235022983/,Fall trek will feature support from Lava La Rue and Rachel Chinouriri on select dates,Remi On the Road
"Hear Paul McCartney & Wings' 'Hi, Hi, Hi' From Official Bootleg 'One Hand Clapping'",https://www.rollingstone.com/music/music-news/paul-mccartney-wings-hi-hi-hi-one-hand-clapping-1235022878/,"Nearly 50 years after the band's live-in-studio sessions at Abbey Road for never-aired 1974 documentary, the oft-bootlegged LP will finally be released in June",from the vaults
Kelly Clarkson Ignores the Same Red Flags With Olivia Rodrigo 'Bad Idea Right?' Cover,https://www.rollingstone.com/music/music-news/kelly-clarkson-olivia-rodrigo-bad-idea-right-cover-1235022853/,The performance marks the fifth timeThe Kelly Clarkson Showhost has covered Rodrigo,Kellyoke
New Kids on the Block Are 'Still Kids' as They Drop First Album in 11 Years,https://www.rollingstone.com/music/music-news/new-kids-on-the-block-release-new-album-kids-1235022828/,The 14-track album — featuring DJ Jazzy Jeff and Taylor Dayne — arrives ahead of a massive summer tour,"New Kids, New Record"
Hear Miley Cyrus' Edgy Cover of Talking Heads' 'Psycho Killer',https://www.rollingstone.com/music/music-news/miley-cyrus-talking-heads-psycho-killer-cover-1235022798/,The song appears on compilation albumEveryone’s Getting Involved: A Tribute to Talking Heads’ Stop Making Sense,Classic Covers
T-Pain Finds His Own Way on Inspirational Single 'On This Hill',https://www.rollingstone.com/music/music-news/t-pain-on-this-hill-single-1235022792/,The song was released for Mental Health Awareness Month,Listen Up
Zayn Reaches for the Heavens in 'Stardust' Music Video,https://www.rollingstone.com/music/music-news/zayn-stardust-music-video-1235022786/,"The track appears on the singer's new album,Room Under the Stars",Sky High
Watch Peso Pluma Showcase Hit Single 'La Durango' on 'Fallon',https://www.rollingstone.com/music/music-news/peso-pluma-la-durango-performance-fallon-1235022781/,The Mexican singer tapped Eslabon Armado's Pedro Tovar for the live performance,Late-Night TV
Saweetie's New Single 'Nani' Will Get You Ready for the Summer,https://www.rollingstone.com/music/music-news/saweetie-nani-video-1235020934/,"""Two shows. One night. What’s that? A hunnid plus,"" Saweetie raps over a sticky beat",It's a Nani Summer
Billie Eilish Releases Highly Anticipated Third Studio Album 'Hit Me Hard and Soft',https://www.rollingstone.com/music/music-news/billie-eilish-hit-me-hard-and-soft-release-1235022373/,The singer opted to withhold releasing any singles ahead of the album's arrival to allow for it to all be consumed at once,Out Now
"Watch Post Malone, Reba McEntire Pay Tribute to Dickey Betts With 'Ramblin' Man' at 2024 ACMs",https://www.rollingstone.com/music/music-news/post-malone-reba-mcentire-dickey-betts-tribute-2024-acm-awards-1235022679/,"The pair delivered an impromptu a cappella performance of the Allman Brothers hit in honor of Betts, who died in April",ACM Awards 2024
Cher and Son Elijah Blue Allman ‘Pause’ Conservatorship War Amid Mediation,https://www.rollingstone.com/music/music-news/cher-son-elijah-blue-allman-pause-conservatorship-mediation-1235022493/,The singer previously sought a conservatorship to address her son's alleged addiction and mental health concerns,COURTS
Sean Combs' Accused Drug 'Mule' Strikes Deal in Cocaine Case,https://www.rollingstone.com/music/music-news/sean-combs-accused-drug-mule-gets-deal-in-cocaine-case-1235021196/,"Brendan Paul will avoid any jail time following his arrest on March 25. As part of the deal, he will have to enroll in a drug diversion program",COURTS AND CRIME
Nicholas Galitzine Dances All Night to the Best Song Ever in August Moon 'Guard Down' Video,https://www.rollingstone.com/music/music-news/nicholas-galitzine-august-moon-guard-down-video-1235022167/,"A snippet of the video is featured in Prime Video'sThe Idea of Youwhich stars Galitzine as the frontman of August Moon, the boyband that leads him straight into a romance with a fan's mom",The Idea of You
Kamala Harris' Renaissance Tour Tickets Were on the House Courtesy of Beyoncé,https://www.rollingstone.com/music/music-news/kamala-harris-beyonce-gifted-renaissance-tour-tickets-1235022057/,The VP's annual financial disclosure report reveals Beyoncé gifted her tickets to the 2023 concert valued at more than $1600,House of Renaissance
Drake Leads 2024 BET Awards With Seven Nominations,https://www.rollingstone.com/music/music-news/drake-nicki-minaj-2024-bet-awards-1235022052/,Rapper will face off against Kendrick Lamar in two categories: Best Male Hip-Hop Artist and Best Collaboration,2024 BET Awards
Kings of Leon Take Creative Control in 'Seen' Video: It's 'More Authentic',https://www.rollingstone.com/music/music-news/kings-of-leon-seen-music-video-exclusive-1235021893/,"""We've found that the more control we take, over all aspects of the creative process, the more authentic the experience is for us and the fans,"" Jared Followill tellsRolling Stone",Exclusive
See Black Crowes Bring Out Steven Tyler to Perform 'Mama Kin' at London Gig,https://www.rollingstone.com/music/music-news/black-crowes-steven-tyler-mama-kin-1235021965/,"The Robinson brothers, who also welcomed Jimmy Page to their concert, are set to rejoin Aerosmith's ""Peace Out"" farewell tour in September",'a legend'
"Cardi B Is Done With All Politicians: 'Damn, Y’all Not Caring About Nobody'",https://www.rollingstone.com/music/music-news/cardi-b-biden-trump-2024-election-1235021237/,"The rapper discussed her disillusionment with Joe Biden, Donald Trump, and the American political system at large, saying, ""I feel like people got betrayed""",Politricks
The Tribute Is Theirs: Lila Iké and H.E.R. Honor a Nineties R&B Touchstone,https://www.rollingstone.com/music/music-news/lila-ike-her-he-loves-us-both-1235015640/,"On ""He Loves Us Both,"" the Jamaican star and alt-R&B heroine take inspiration from Brandy and Monica's ""The Boy Is Mine""",Exclusive
Cardi B on the Ups and Downs of Her Marriage With Offset: 'We Do Love Each Other',https://www.rollingstone.com/music/music-news/cardi-b-complicated-offset-relationship-marriage-parenting-1235021184/,"""It’s not even about ‘How do you leave a partner?’ How do you stop talking to your best friend?""",Relationship Status
The Beach Boys Hold 'Family Reunion' at 'Surfin' Safari' Spot in Clip From Band's Documentary,https://www.rollingstone.com/music/music-news/the-beach-boys-family-reunion-documentary-clip-1235021836/,"Director Frank Marshall brings Brian Wilson, Mike Love, Al Jardine, and more back to Paradise Cove in this exclusive excerpt fromThe Beach Boys",where it all started
Watch Kelly Clarkson Perform 'Say It Ain't So' With Weezer,https://www.rollingstone.com/music/music-news/kelly-clarkson-weezer-say-it-aint-so-performance-1235021809/,The rock band also spoke with the TV host about the 30th anniversary of their debut LP,Cool Collab
Donna Summer's Estate Reaches Settlement With Kanye West Over Alleged 'Theft' of 'I Feel Love',https://www.rollingstone.com/music/music-news/donna-summers-estate-settlement-kanye-west-i-feel-love-1235021727/,"Summer's widower, Bruce Sudano, previously toldRolling Stonehe intended ""to protect"" his late wife's copyright",Found a Groove
"Marilyn Manson Signs New Record Deal, Teases First Music Since Sexual Assault Allegations",https://www.rollingstone.com/music/music-news/marilyn-manson-signs-nuclear-blast-records-assault-allegations-1235021688/,Rolling Stoneconfirmed the deal with Nuclear Blast after the musician and metal label shared a short clip that appeared to feature a new song,Comeback?
Kehlani Sets Summer Release for New Studio Album 'Crash',https://www.rollingstone.com/music/music-news/kehlani-crash-album-announcement-1235021583/,"The album, her first since 2022'sBlue Water Road, is scheduled to arrive on June 21 featuring the lead single ""After Hours""",Heating Up
Astroworld: Last Remaining Wrongful Death Suit Has A New Trial Date,https://www.rollingstone.com/music/music-news/astroworld-wrongful-death-suit-has-a-new-trial-date-1235021538/,"The family of Ezra Blount, the youngest victim who died at the festival, is set to go to trial in September",Astroworld
Publishers Send Cease-and-Desist to Spotify over Unlicensed Content,https://www.rollingstone.com/music/music-news/spotify-gets-cease-and-desist-from-music-publishers-1235021253/,The letter comes as tensions rise between Spotify and the NMPA over reduced royalty payouts tied to the streaming service's music and audiobooks bundle,Heating Up
Chicago House Music's 40th Anniversary to Be Celebrated in Windy City,https://www.rollingstone.com/music/music-news/chicago-house-music-anniversary-event-1235021299/,Derrick Carter and DJ Heather will play music at the event this month,This Old House
"Tame Impala's Kevin Parker Sells Entire Catalog, Including Future Works, to Sony Music Publishing",https://www.rollingstone.com/music/music-news/tame-impala-kevin-parker-sells-catalog-sony-music-publishing-1235021293/,"""The idea of passing on ownership of my songs is one that I don't think about very lightly, at all,"" singer says of deal","'blood, sweat and creativity'"
Why 'Mr. Brightside' Has Remained on the Charts for a Decade and Counting,https://www.rollingstone.com/music/music-news/the-killers-mr-brightside-500-greatest-songs-podcast-1235019687/,"On the latest episode of our500 Greatest Songspodcast, mixing engineer Mark Needham talks about leaving a Fleetwood Mac session to work on a young Las Vegas band's future megahit",500 Greatest Songs
"Omar Apollo Announces Sophomore Album, 'God Said No'",https://www.rollingstone.com/music/music-news/omar-apollo-announces-god-said-no-album-1235021261/,"""The album doesn’t feel like it’s a bunch of songs put together. It’s a sequence that is made to be listened to front to back,"" Apollo toldRolling Stoneabout the LP featuring Pedro Pascal, Mustafa",Dios No Quiso
Beth Gibbons Will Break Your Heart With 'Lost Changes',https://www.rollingstone.com/music/music-news/beth-gibbons-lost-changes-lives-outgrown-1235021235/,"Song is final single to arrive ahead of Portishead frontwoman's solo debut,Lives Outgrown",'Forever Ends'
Milo Yiannopoulos Parts Ways With Kanye West Over Yeezy Porn Plan,https://www.rollingstone.com/music/music-news/milo-yiannopoulos-resigns-kanye-west-yeezy-porn-plan-1235021194/,"The alt-right provocateur, who was the rapper's chief of staff, resigned on Wednesday saying he ""cannot be complicit in the production of dissemination of pornographic films""",PULLING OUT
Keith Urban Covers Ariana Grande's 'We Can't Be Friends': 'It’s Like Audible Heroin',https://www.rollingstone.com/music/music-news/keith-urban-ariana-grande-we-cant-be-friends-cover-1235021207/,The musician performed theEternal Sunshinesingle during an acoustic set in a small club,What Did She Put in This
'Becoming Led Zeppelin': First-Ever Authorized Doc About Band Acquired by Sony Pictures Classics,https://www.rollingstone.com/music/music-news/becoming-led-zeppelin-sony-pictures-classics-1235021218/,"""""The energy of the story, and the power of the music, is phenomenal,"" Jimmy Page says of long-awaited ""hybrid docu-concert film""",'definitive'
Avril Lavigne Is Considering Adding Kelly Clarkson's 'Breakaway' to Her Greatest Hits Tour Setlist,https://www.rollingstone.com/music/music-news/avril-lavigne-will-cover-kelly-clarksons-breakaway-greatest-hits-tour-1235021141/,"Lavigne initially wrote ""Breakaway"" for her debut album, but when it didn't make the cut, the record ended up in Clarkson's hands",When the Snow Would Fall
Revisit John Lennon's 'Mind Games' This Summer With Massive 'Ultimate Collection' Release,https://www.rollingstone.com/music/music-news/john-lennon-mind-games-ultimate-collection-reissue-1235020373/,Immerse yourself into the Beatle's 1973 solo album with six different mixes,You Are Here
Rita Ora Teases New Music During Appearance on 'Kelly Clarkson Show',https://www.rollingstone.com/music/music-news/rita-ora-new-music-interview-the-kelly-clarkson-show-1235021112/,The singer also previewed her upcoming European festival dates this summer,Coming Soon
"Watch Lauryn Hill, YG Marley Perform Collaborative Medley on 'Fallon'",https://www.rollingstone.com/music/music-news/lauryn-hill-yg-marley-medley-performance-fallon-1235021101/,"The duo showcased ""Ex-Factor,"" ""Survival,"" and ""Praise Jah in the Moonlight""",Late-Night TV
Bruce Springsteen and the E Street Band Will Chronicle Tour Prep in 'Road Diary' Documentary,https://www.rollingstone.com/music/music-news/bruce-springsteen-e-street-band-world-tour-documentary-1235020602/,The feature film following the band's preparation for their first tour in six years will be released on Hulu and Disney+ this October,Bruce Behind the Scenes
"John Barbata, Drummer for the Turtles and Jefferson Starship, Dead at 79",https://www.rollingstone.com/music/music-news/john-barbata-drummer-the-turtles-csny-jefferson-starship-dead-obituary-1235019260/,"Session musician also played on Crosby, Stills, Nash & Young's4 Way Streetand its single ""Ohio""",Obituary
Detroit Newspaper Mourns 'Tortured Existence' of Eminem's Slim Shady in Obituary,https://www.rollingstone.com/music/music-news/eminem-slim-shady-dead-obituary-detroit-free-press-newspaper-1235020421/,"The rapper's forthcoming album,The Death of Slim Shady(Coup de Grace), is scheduled to arrive this summer",Slim Six Feet Under Shady
Watch David Bowie and David Sanborn Serenade the 'Young Americans' on 'Dick Cavett',https://www.rollingstone.com/music/music-news/david-bowie-david-sanborn-young-americans-1235020337/,"Decades later, the saxophonist, who died Sunday, warmly recalled his time backing Bowie on one of his most iconic albums",Flashback
"Chris Stapleton Takes 'Loving You on My Mind' Higher With the War and Treaty, Jennifer Hudson",https://www.rollingstone.com/music/music-news/chris-stapleton-loving-you-on-my-mind-jennifer-hudson-1235020309/,"The three acts performed the song from Stapleton's latest studio album,Higher, during a new episode ofThe Jennifer Hudson Show",Three's Company
"Foo Fighters, Noah Kahan to Headline Inaugural Soundside Fest in Connecticut",https://www.rollingstone.com/music/music-news/foo-fighters-noah-kahan-headline-soundside-fest-connecticut-1235019949/,"Teddy Swims, Norah Jones, Goo Goo Dolls, and Boyz II Men will also perform",Music in CT
Watch Graham Nash's Surprise Performance of 'Our House' at Carnegie Hall CSN Tribute,https://www.rollingstone.com/music/music-news/graham-nashs-our-house-carnegie-hall-csn-tribute-1235020293/,"The trio was honored with a charity show featuring Todd Rundgren, Steve Earle, Yola, Guster, Rickie Lee Jones, and many others",Carry On
Snoop Dogg Will Reunite With Crip-Walking Horse at 2024 Olympics and Boost Rising Stars on ‘The Voice’,https://www.rollingstone.com/music/music-news/snoop-dogg-2024-olympics-the-voice-tonight-show-1235020285/,The rapper recently appeared onThe Tonight Show Starring Jimmy Fallonto tease his busy year ahead,Snoop of All Trades
"Viral Conspiracy Theories About Drake, Kendrick Beef Are Spreading Fast",https://www.rollingstone.com/music/music-news/drake-kendrick-beef-conspiracy-theories-1235020176/,A reporter came forward to clear his name after speculation about alleged security camera footage from Drake's hotel caught like wildfire,Smoke and Mirrors
Kelly Clarkson Enters 'Trolls' Land With ’NSync Cover,https://www.rollingstone.com/music/music-news/kelly-clarkson-covers-nsync-better-place-1235020157/,Justin Timberlake joined Clarkson in January and teased that more music from ’NSync was on the way,NSYNClarkson
Snoop Dogg and Michael Bublé Join Reba McEntire and Gwen Stefani as 'The Voice' Coaches,https://www.rollingstone.com/music/music-news/snoop-dogg-michael-buble-the-voice-season-26-coaches-1235019561/,The rapper and singer will round out the coaches panel for the singing competition's upcoming 26th season,Powerhouse Panel
"David Sanborn, Jazz Saxophonist Who Played on David Bowie's 'Young Americans,' Dead at 78",https://www.rollingstone.com/music/music-news/david-sanborn-jazz-saxophonist-dead-obituary-1235019601/,"The musician, who won several Grammys and also collaborated with the Rolling Stones, Stevie Wonder, Paul Simon, and others, had been battling prostate cancer",Obituary
Gracie Abrams' New Album Features Taylor Swift Collaboration,https://www.rollingstone.com/music/music-news/gracie-abrams-album-taylor-swift-collaboration-1235019621/,Abrams joined Swift as an opener for the Eras Tour last summer,Just Us
Kendrick Lamar Lands Two Top 10 Songs With Drake Diss 'Not Like Us' at Number One,https://www.rollingstone.com/music/music-news/kendrick-lamar-number-one-not-like-us-drake-diss-hot-100-1235019321/,"Rapper's ""Euphoria"" rises 11-3 this week, while Drake's ""Family Matters"" debuted at Number Seven",Beef
Taylor Swift Celebrates 'Tortured Poets' Induction Into Eras Tour Set List: It's 'Female Rage the Musical',https://www.rollingstone.com/music/music-news/taylor-swift-tortured-poets-eras-tour-set-list-post-1235019481/,"The singer recently resumed her career-spanning tour with the addition of a brand new section featuring  new music, choreography, and costumes from her latest albumThe Tortured Poets Department",Fired Up
Watch Bruce Springsteen and the E Street Band Cover 'A Rainy Night in Soho' in Ireland,https://www.rollingstone.com/music/music-news/bruce-springsteen-cover-a-rainy-night-in-soho-1235019413/,The tribute to Shane MacGowan marked Springsteen's first performance of a Pogues song,Remembering Shane
David Gilmour Sets First U.S. Tour Dates in Eight Years,https://www.rollingstone.com/music/music-news/david-gilmour-us-tour-dates-1235019330/,"Artist teases tour with video that includes his new solo song, ""The Piper's Call,"" as well as Pink Floyd's ""High Hopes"" and ""Comfortably Numb""",On the Run
Childish Gambino Surprise-Drops Complete '3.15.20' Album and Plots New World Tour,https://www.rollingstone.com/music/music-news/childish-gambino-drops-atavista-album-1235018778/,"Atavistaarrives with two new songs and reimagined versions of songs from 2020's3.15.20, which includes collabs with Ariana Grande, 21 Savage, and Young Nudy",Real and Reimagined
Touch and Go’s Corey Rusk Remembers ‘Supernaturally Talented’ Friend Steve Albini,https://www.rollingstone.com/music/music-news/touch-and-go-corey-rusk-steve-albini-tribute-1235019267/,"The artist “was a member of more bands on Touch and Go than any other musician,” Rusk says, adding he played on and also recorded more T&G releases than anyone else",In Memoriam
See Foo Fighters Pull 'Eruption' Prank With Wolfgang Van Halen at Welcome to Rockville,https://www.rollingstone.com/music/music-news/foo-fighters-prank-wolfgang-van-halen-welcome-to-rockville-1235019249/,Dave Grohl enlists Mammoth WVH frontman to deliver classic Van Halen solos during headlining set at Daytona Beach festival,punk'd
Switzerland's Nemo Wins 2024 Eurovision Song Contest,https://www.rollingstone.com/music/music-news/eurovision-song-contest-winner-2024-nemo-the-code-1235018866/,"The Swiss singer wowed the jury and the public with their performance of ""The Code""",Eurovision 2024
"Watch Taylor Swift Play ‘Hey Stephen,’ ‘Maroon’ at Eras Tour in Paris",https://www.rollingstone.com/music/music-news/taylor-swift-hey-stephen-maroon-paris-eras-tour-1235019126/,"During her penultimate tour stop in Paris for this leg of her Eras trek, she performed surpriseFearlessandMidnightsfavorites",Penultimate Paris Date
See Jelly Roll Join Limp Bizkit to Cover the Who at Welcome to Rockville,https://www.rollingstone.com/music/music-news/jelly-roll-limp-bizkit-the-who-welcome-to-rockville-1235019078/,"Country star plays the role of an angel summoned to save Fred Durst during band's rendition of ""Behind Blue Eyes""",😇
"Joanna Newsom Pays Tribute to 'Hilarious, Loving, Loyal Friend' Steve Albini at Utah Fest",https://www.rollingstone.com/music/music-news/joanna-newsom-steve-albini-tribute-1235019066/,"Singer - who recorded her LPsYsandDiverswith Albini - dedicates ""Cosmia"" to noise-rock pioneer and engineer",'i miss him'
Netherlands' Eurovision Contestant Disqualified From Finals After Incident With Crew Member,https://www.rollingstone.com/music/music-news/netherlands-eurovision-contestant-disqualified-finals-incident-crew-member-1235019044/,"Swedish police investigating ""unlawful threats"" Dutch singer made to female production crew member after semifinals performance",euro-drama
Taylor Swift Debuts 'My Boy Only Breaks His Favorite Toys' Live at Paris Eras Tour,https://www.rollingstone.com/music/music-news/taylor-swift-my-boy-only-breaks-his-favorite-toys-eras-tour-1235018927/,"The singer also performed a mashup of ""Is It Over Now?"" and ""Out Of The Woods"" during her second night in France",Live Debut
Ryan Castro Declares Himself 'El Cantante Del Ghetto' With New Album,https://www.rollingstone.com/music/music-news/ryan-castro-drops-el-cantante-del-ghetto-album-1235018812/,"The LP features collaborations with Peso Pluma, Yandel, Blessd, and Arcángel",Para Colombia
Shakira Avoids Additional Charges in Spanish Tax Fraud Case,https://www.rollingstone.com/music/music-news/shakira-avoids-additional-charges-spanish-tax-fraud-case-1235018891/,"Seven months after singer settled tax fraud case, investigative magistrate finds insufficient evidence of more withheld income taxes",Duty Free
Watch Neil Young and Crazy Horse Perform 'Sedan Delivery' for First Time Since 2013,https://www.rollingstone.com/music/music-news/neil-young-crazy-horse-sedan-delivery-1235018796/,"Their rain-delayed show in Franklin, Tennessee, was packed with surprises, including the first Crazy Horse rendition of 'Vampire Blues'",Live Rust
RM Left 'Come Back to Me' Video Shoot to Get Stitches — and Came Right Back to Work,https://www.rollingstone.com/music/music-news/rm-bts-come-back-to-me-video-injury-1235018776/,"""Immediately I thought, ‘Oh great, I’m going to be deported immediately because I’ve just scratched this national treasure,'” director Lee Sung Jin said",Shoot Stitches
Third Incident Reported Outside Drake's Toronto Mansion,https://www.rollingstone.com/music/music-news/third-incident-trespasser-shooting-drake-toronto-mansion-1235018798/,"After one of the rapper's security guards was shot earlier this week, two people have since attempted to trespass on Drake's Bridle Path property",crimes and court
Tems Maps Out First World Tour in Support of Debut Album 'Born in the Wild',https://www.rollingstone.com/music/music-news/tems-born-in-the-wild-world-tour-dates-1235018721/,"After years of waiting, Nigerian singer's first LP arrives June 7",on the road
